Paper ID,Status,Title,Contact Name,Contact Email,Note,Decision,Overall Score,Comments to Authors,Camera-Ready Extended Abstract (2 pages),Camera-Ready Extended Abstract (2 pages) pages,Camera-Ready Extended Abstract (2 pages) paper size,Camera-Ready Extended Abstract (2 pages) last update,Promotional Image,Presenting author,Abstract,Video URL (3-5 min),Video URL (30 sec),Author 1 - id,Author 1 - prefix,Author 1 - first,Author 1 - middle,Author 1 - last,Author 1 - suffix,Author 1 - email,Author 1 - dept/school/lab 1,Author 1 - institution 1,Author 1 - city 1,Author 1 - state/prov 1,Author 1 - country 1,Author 1 - dept/school/lab 2,Author 1 - institution 2,Author 1 - city 2,Author 1 - state/prov 2,Author 1 - country 2,Author 2 - id,Author 2 - prefix,Author 2 - first,Author 2 - middle,Author 2 - last,Author 2 - suffix,Author 2 - email,Author 2 - dept/school/lab 1,Author 2 - institution 1,Author 2 - city 1,Author 2 - state/prov 1,Author 2 - country 1,Author 2 - dept/school/lab 2,Author 2 - institution 2,Author 2 - city 2,Author 2 - state/prov 2,Author 2 - country 2,Author 3 - id,Author 3 - prefix,Author 3 - first,Author 3 - middle,Author 3 - last,Author 3 - suffix,Author 3 - email,Author 3 - dept/school/lab 1,Author 3 - institution 1,Author 3 - city 1,Author 3 - state/prov 1,Author 3 - country 1,Author 3 - dept/school/lab 2,Author 3 - institution 2,Author 3 - city 2,Author 3 - state/prov 2,Author 3 - country 2,Author 4 - id,Author 4 - prefix,Author 4 - first,Author 4 - middle,Author 4 - last,Author 4 - suffix,Author 4 - email,Author 4 - dept/school/lab 1,Author 4 - institution 1,Author 4 - city 1,Author 4 - state/prov 1,Author 4 - country 1,Author 4 - dept/school/lab 2,Author 4 - institution 2,Author 4 - city 2,Author 4 - state/prov 2,Author 4 - country 2,Author 5 - id,Author 5 - prefix,Author 5 - first,Author 5 - middle,Author 5 - last,Author 5 - suffix,Author 5 - email,Author 5 - dept/school/lab 1,Author 5 - institution 1,Author 5 - city 1,Author 5 - state/prov 1,Author 5 - country 1,Author 5 - dept/school/lab 2,Author 5 - institution 2,Author 5 - city 2,Author 5 - state/prov 2,Author 5 - country 2,Author 6 - id,Author 6 - prefix,Author 6 - first,Author 6 - middle,Author 6 - last,Author 6 - suffix,Author 6 - email,Author 6 - dept/school/lab 1,Author 6 - institution 1,Author 6 - city 1,Author 6 - state/prov 1,Author 6 - country 1,Author 6 - dept/school/lab 2,Author 6 - institution 2,Author 6 - city 2,Author 6 - state/prov 2,Author 6 - country 2,Author 7 - id,Author 7 - prefix,Author 7 - first,Author 7 - middle,Author 7 - last,Author 7 - suffix,Author 7 - email,Author 7 - dept/school/lab 1,Author 7 - institution 1,Author 7 - city 1,Author 7 - state/prov 1,Author 7 - country 1,Author 7 - dept/school/lab 2,Author 7 - institution 2,Author 7 - city 2,Author 7 - state/prov 2,Author 7 - country 2,Author 8 - id,Author 8 - prefix,Author 8 - first,Author 8 - middle,Author 8 - last,Author 8 - suffix,Author 8 - email,Author 8 - dept/school/lab 1,Author 8 - institution 1,Author 8 - city 1,Author 8 - state/prov 1,Author 8 - country 1,Author 8 - dept/school/lab 2,Author 8 - institution 2,Author 8 - city 2,Author 8 - state/prov 2,Author 8 - country 2,Author 9 - id,Author 9 - prefix,Author 9 - first,Author 9 - middle,Author 9 - last,Author 9 - suffix,Author 9 - email,Author 9 - dept/school/lab 1,Author 9 - institution 1,Author 9 - city 1,Author 9 - state/prov 1,Author 9 - country 1,Author 9 - dept/school/lab 2,Author 9 - institution 2,Author 9 - city 2,Author 9 - state/prov 2,Author 9 - country 2,Author 10 - id,Author 10 - prefix,Author 10 - first,Author 10 - middle,Author 10 - last,Author 10 - suffix,Author 10 - email,Author 10 - dept/school/lab 1,Author 10 - institution 1,Author 10 - city 1,Author 10 - state/prov 1,Author 10 - country 1,Author 10 - dept/school/lab 2,Author 10 - institution 2,Author 10 - city 2,Author 10 - state/prov 2,Author 10 - country 2,Author 11 - id,Author 11 - prefix,Author 11 - first,Author 11 - middle,Author 11 - last,Author 11 - suffix,Author 11 - email,Author 11 - dept/school/lab 1,Author 11 - institution 1,Author 11 - city 1,Author 11 - state/prov 1,Author 11 - country 1,Author 11 - dept/school/lab 2,Author 11 - institution 2,Author 11 - city 2,Author 11 - state/prov 2,Author 11 - country 2,Author 12 - id,Author 12 - prefix,Author 12 - first,Author 12 - middle,Author 12 - last,Author 12 - suffix,Author 12 - email,Author 12 - dept/school/lab 1,Author 12 - institution 1,Author 12 - city 1,Author 12 - state/prov 1,Author 12 - country 1,Author 12 - dept/school/lab 2,Author 12 - institution 2,Author 12 - city 2,Author 12 - state/prov 2,Author 12 - country 2,ACM Author Affiliations,"ACM Author Emails, excluding contact email"
PO1063,complete,Demonstration of Petting Interaction with Breathing Cat Using Mid-Air Ultrasound Haptic Feedback,Juro Hosoi,jhosoi@s.h.k.u-tokyo.ac.jp,,A,3.5,,https://0d2f0bc53ec40041bef323f40496ed3c.r2.cloudflarestorage.com/pcs/vr25c/vr25c-sub1063-cam-i5.pdf?X-Amz-Algorithm=AWS4-HMAC-SHA256&X-Amz-Expires=7200&X-Amz-Credential=8c3c5bf11286f4699c7019eaeac51dfe%2F20250203%2Fenam%2Fs3%2Faws4_request&X-Amz-SignedHeaders=host&X-Amz-Date=20250203T201551Z&X-Amz-Signature=e6e071cbfd632960f59f1fc9e8a6c74a4cab9b45c54f2f65e0f9cf3a9b84b6ff,2,letter,2025-01-27 7:56,https://0d2f0bc53ec40041bef323f40496ed3c.r2.cloudflarestorage.com/pcs/vr25c/vr25c-sub1063-cam-i18.png?X-Amz-Algorithm=AWS4-HMAC-SHA256&X-Amz-Expires=7200&X-Amz-Credential=8c3c5bf11286f4699c7019eaeac51dfe%2F20250203%2Fenam%2Fs3%2Faws4_request&X-Amz-SignedHeaders=host&X-Amz-Date=20250203T201551Z&X-Amz-Signature=293919ce39f6131e80be7440b3a95a87ad761d25b3abde89f9b16029bbba7100,Juro Hosoi,"This study introduces a petting interaction system with a virtual breathing cat, utilizing mid-air ultrasound haptic feedback to enhance the realism of pet experiences in virtual reality (VR). Previous research has focused mainly on the tactile presentation of the fur texture, and interaction with realistic virtual animals has not been fully investigated. Therefore, based on the prior work, the proposed system employs airborne ultrasound tactile displays (AUTDs) and a hand tracking camera to deliver real-time, non-contact haptic feedback simulating not only the soft fur texture but also the breathing motion. By dynamically controlling the ultrasound focal point’s position and intensity, the system reproduces the tactile sensations of fur stroking and rhythmic respiratory motion. The visual component features a 3D cat model synchronized with breathing cycles, situated in a familiar domestic setting. User experience design focused on creating a calming interaction, with tactile feedback adjusting based on hand movement patterns.",https://youtu.be/oQrccIH301Y,,u9VW3yTLUCD1dhH-E_IBdfw,,Juro,,Hosoi,,jhosoi@s.h.k.u-tokyo.ac.jp,The Graduate School of Frontier Sciences,The University of Tokyo,Chiba,,Japan,,,,,,udnlKV10-6jTVMQTXEoIVrg,,Yuki,,Ban,,ban@edu.k.u-tokyo.ac.jp,,The University of Tokyo,Kashiwanoha,Chiba,Japan,,,,,,urXj8nWGIFv3Y8CtfzJAQeg,Professor,Shinichi,,Warisawa,,warisawa@edu.k.u-tokyo.ac.jp,,The University of Tokyo,Kashiwa,,Japan,,,,,,,,,,,,,,,,,,,,,,,,,,,,,,,,,,,,,,,,,,,,,,,,,,,,,,,,,,,,,,,,,,,,,,,,,,,,,,,,,,,,,,,,,,,,,,,,,,,,,,,,,,,,,,,,,,,,,,,,,,,,,,,,,,,,,,,,,,,,,,,,,,,,,,,,,,,,,,,Juro Hosoi: The University of Tokyo; Yuki Ban: The University of Tokyo; Shinichi Warisawa: The University of Tokyo,ban@edu.k.u-tokyo.ac.jp; warisawa@edu.k.u-tokyo.ac.jp
PO1084,complete,Demonstration of Directional Force Feedback in Virtual Reality Tennis using Dual-Flywheel Haptics,Jasmine Roberts,jar053@ucsd.edu,,A,4,,https://0d2f0bc53ec40041bef323f40496ed3c.r2.cloudflarestorage.com/pcs/vr25c/vr25c-sub1084-cam-i5.pdf?X-Amz-Algorithm=AWS4-HMAC-SHA256&X-Amz-Expires=7200&X-Amz-Credential=8c3c5bf11286f4699c7019eaeac51dfe%2F20250203%2Fenam%2Fs3%2Faws4_request&X-Amz-SignedHeaders=host&X-Amz-Date=20250203T201551Z&X-Amz-Signature=8cfc8994627c5783fb949758208f38e7fa606e6cc8ef0b90d7f2844b36971725,2,letter,2025-01-31 16:22,https://0d2f0bc53ec40041bef323f40496ed3c.r2.cloudflarestorage.com/pcs/vr25c/vr25c-sub1084-cam-i18.png?X-Amz-Algorithm=AWS4-HMAC-SHA256&X-Amz-Expires=7200&X-Amz-Credential=8c3c5bf11286f4699c7019eaeac51dfe%2F20250203%2Fenam%2Fs3%2Faws4_request&X-Amz-SignedHeaders=host&X-Amz-Date=20250203T201551Z&X-Amz-Signature=1e4880c2d823b8a855abba1fb38d234fc46be52a5cacae5dd39ae5129da0fe05,Jasmine Roberts,"This demo introduces a haptic feedback device for tennis simulation, designed to provide realistic physical sensations of ball impact through interaction with a virtual racket model. The system integrates with a Unity-based virtual setup where users are visually immersed in a virtual tennis court environment. Unlike previous systems, this device incorporates a mechanical interface that replicates the sensation of a tennis ball striking the racket using a dual flywheel system. This approach follows a one-controller, one-function paradigm, where each input device is dedicated to a specific function rather than serving as a general-purpose controller. This targeted design enhances realism and improves user immersion by providing precise, specialized feedback rather than distributing multiple functionalities across a single device. Furthermore, this system aligns with augmented virtuality, as it brings physical sensations into an otherwise fully virtual environment, reinforcing the sense of realism and presence.",https://youtu.be/sBvCS_lmmE0,,uV0dC_UQr_AuMDAZVJ4UYFQ,,Allyson,E,Chen,,aechen@ucsd.edu,,"University of California, San Diego",La Jolla,California,United States,,,,,,uPZK1eg_b7klY1Rhxshz1tQ,,Xuan,,Gedney,,xgedney@ucsd.edu,,University of California San Diego ,La Jolla ,California,United States,,,,,,ukJVZvMvrrME6EMFwh0Uc-Q,,Jasmine,,Roberts,,jar053@ucsd.edu,,"University of California, San Digo ",La Jolla ,California,United States,,,,,,,,,,,,,,,,,,,,,,,,,,,,,,,,,,,,,,,,,,,,,,,,,,,,,,,,,,,,,,,,,,,,,,,,,,,,,,,,,,,,,,,,,,,,,,,,,,,,,,,,,,,,,,,,,,,,,,,,,,,,,,,,,,,,,,,,,,,,,,,,,,,,,,,,,,,,,,,"Allyson E Chen: University of California, San Diego; Xuan Gedney: University of California San Diego ; Jasmine Roberts: University of California, San Digo ",aechen@ucsd.edu; xgedney@ucsd.edu
PO1080,complete,FirstModulAR: Open Source Modular Augmented Reality Interfaces for First Responders,Regis Kopper,kopper@iastate.edu,,A,4,,https://0d2f0bc53ec40041bef323f40496ed3c.r2.cloudflarestorage.com/pcs/vr25c/vr25c-sub1080-cam-i5.pdf?X-Amz-Algorithm=AWS4-HMAC-SHA256&X-Amz-Expires=7200&X-Amz-Credential=8c3c5bf11286f4699c7019eaeac51dfe%2F20250203%2Fenam%2Fs3%2Faws4_request&X-Amz-SignedHeaders=host&X-Amz-Date=20250203T201551Z&X-Amz-Signature=04d08340c69429b3868bce4204a3e56c7eaa04d448f4ab9e25e0479c85ac2a3d,2,letter,2025-01-29 0:25,https://0d2f0bc53ec40041bef323f40496ed3c.r2.cloudflarestorage.com/pcs/vr25c/vr25c-sub1080-cam-i18.png?X-Amz-Algorithm=AWS4-HMAC-SHA256&X-Amz-Expires=7200&X-Amz-Credential=8c3c5bf11286f4699c7019eaeac51dfe%2F20250203%2Fenam%2Fs3%2Faws4_request&X-Amz-SignedHeaders=host&X-Amz-Date=20250203T201551Z&X-Amz-Signature=4e74f77bd2cb800ec73411c789471fab57d9d7434c4a58ad9753dd2512e7a38c,Regis Kopper,"First responders operate in high-pressure environments where decisions must be made quickly and accurately. However, the increasing availability of real-time data presents a double-edged sword; while potentially valuable, the sheer volume of information can lead to cognitive overload, compromising situational awareness and performance. The FirstModulAR project seeks to address these challenges by developing modular Augmented Reality (AR) interfaces specifically tailored to public safety. By working closely with first responders, the project focuses on creating reusable AR modules that improve situational awareness and decision-making across diverse scenarios. This paper provides an overview of the system architecture, the modular design approach, and the integration of AR solutions into realistic public safety scenarios.",https://drive.google.com/file/d/1ShRMSL9gtKB-2o49o7LP1_u5karlGcvk/view?usp=share_link,,ul06o78T_Y7tH8JaOMZt1qQ,,Regis,,Kopper,,kopper@iastate.edu,Department of Computer Science,Iowa State University,Ames,Iowa,United States,,,,,,uBLiRxXnEkqm0n8Gv_2Wwpw,,Jeronimo,,Grandi,,jgrandi@augusta.edu,Computer & Cyber Sciences,Augusta University,Augusta,Georgia,United States,,,,,,uHAA817rE8NUHh_cP3hnMhA,,Erin,,Argo,,dargo@augusta.edu,,Augusta University,Augusta,Georgia,United States,,,,,,u3Jf2ey1IaR159bGJh4xi9w,,Jason,,Jerald,,jason@nextgeninteractions.com,,NextGen Interactions,Raleigh,North Carolina,United States,,,,,,uTGJDe0ug6pvcBteUCsToQQ,,Rich,,Bennett,,rich@nextgeninteractions.com,,NextGen Interactions,Raleigh,North Carolina,United States,,,,,,u0UaHSehz0FmWdxx47uIdlQ,,Connor,,Shipway,,connor@nextgeninteractions.com,,NextGen Interactions,Raleigh,North Carolina,United States,,,,,,,,,,,,,,,,,,,,,,,,,,,,,,,,,,,,,,,,,,,,,,,,,,,,,,,,,,,,,,,,,,,,,,,,,,,,,,,,,,,,,,,,,,,,,,,,,,,,,,,,,,,,Regis Kopper: Iowa State University; Jeronimo Grandi: Augusta University; Erin Argo: Augusta University; Jason Jerald: NextGen Interactions; Rich Bennett: NextGen Interactions; Connor Shipway: NextGen Interactions,jgrandi@augusta.edu; dargo@augusta.edu; jason@nextgeninteractions.com; rich@nextgeninteractions.com; connor@nextgeninteractions.com
PO1029,complete,"StimulHeat: a Clip-On, Low-Energy and Wireless Device for Thermal Feedback when Grasping in VR",Sophie Villenave,sophie.villenave@ec-lyon.fr,,A,3.5,,https://0d2f0bc53ec40041bef323f40496ed3c.r2.cloudflarestorage.com/pcs/vr25c/vr25c-sub1029-cam-i5.pdf?X-Amz-Algorithm=AWS4-HMAC-SHA256&X-Amz-Expires=7200&X-Amz-Credential=8c3c5bf11286f4699c7019eaeac51dfe%2F20250203%2Fenam%2Fs3%2Faws4_request&X-Amz-SignedHeaders=host&X-Amz-Date=20250203T201551Z&X-Amz-Signature=fa7629ae717f247b6473052dd5f3a9a80f8781d2ca2446b76726658fa0fa7a48,2,letter,2025-01-24 13:31,https://0d2f0bc53ec40041bef323f40496ed3c.r2.cloudflarestorage.com/pcs/vr25c/vr25c-sub1029-cam-i18.png?X-Amz-Algorithm=AWS4-HMAC-SHA256&X-Amz-Expires=7200&X-Amz-Credential=8c3c5bf11286f4699c7019eaeac51dfe%2F20250203%2Fenam%2Fs3%2Faws4_request&X-Amz-SignedHeaders=host&X-Amz-Date=20250203T201551Z&X-Amz-Signature=1b3456e0d4995b6554988a1ba71fcc2db9ff00c340055df5ac69d462cc98df6c,Matthieu Mesnage,"Adding thermal feedback to Virtual Reality (VR) experience enhances user immersion and the resulting feeling of presence. Our device, StimulHeat, provides a wireless, low-power and easy-to-use solution for delivering hot and cold sensations in VR, particularly when grasping objects. This demonstration highlights its integration with Valve Index Controllers, though it can be adapted to various controllers or tangible interfaces for both augmented and mixed reality experiences.",https://youtu.be/_0hOmilWdRA,,u1aVc2Q3oAE_bGJKxgoHuAw,,Matthieu,,Mesnage,,matthieu.mesnage@insa-lyon.fr,,"INSA Lyon, Ecole Centrale Lyon, Universite Claude Bernard Lyon 1, CPE Lyon, CNRS, INL UMR 5270, 69100",Villeurbanne,,France,,,,,,u5YW5_eEJ0hyRzWze2I9qoA,,Sophie,,Villenave,,sophie.villenave@ec-lyon.fr,,"Ecole Centrale de Lyon, CNRS, INSA Lyon, Universite Claude Bernard Lyon 1, Université Lumière Lyon 2, LIRIS, UMR5205, ENISE",Saint-Etienne,,France,,,,,,ucB1dUXQDZTcHcCivsHBO-g,,Pierre,,Raimbaud,,pierre.raimbaud.pr@gmail.com,,"Ecole Centrale de Lyon, CNRS, INSA Lyon, Universite Claude Bernard Lyon 1, Université Lumière Lyon 2, LIRIS, UMR5205, ENISE",Saint Etienne,,France,,,,,,uMmAJOBHKgts2TGlYEJXE4Q,,Guillaume,,Lavoué,,glavoue@liris.cnrs.fr,,"Ecole Centrale de Lyon, CNRS, INSA Lyon, Universite Claude Bernard Lyon 1, Université Lumière Lyon 2, LIRIS, UMR5205, ENISE",Saint-Etienne,,France,,,,,,u5k43MYcClNkIPf_i7NlSDA,Dr,Bertrand,,Massot,,bertrand.massot@insa-lyon.fr,,"INSA Lyon, Ecole Centrale Lyon, Universite Claude Bernard Lyon 1, CPE Lyon, CNRS, INL UMR 5270",Villeurbanne,,France,,,,,,,,,,,,,,,,,,,,,,,,,,,,,,,,,,,,,,,,,,,,,,,,,,,,,,,,,,,,,,,,,,,,,,,,,,,,,,,,,,,,,,,,,,,,,,,,,,,,,,,,,,,,,,,,,,,,,,,,,,,,,"Matthieu Mesnage: INSA Lyon, Ecole Centrale Lyon, Universite Claude Bernard Lyon 1, CPE Lyon, CNRS, INL UMR 5270, 69100; Sophie Villenave: Ecole Centrale de Lyon, CNRS, INSA Lyon, Universite Claude Bernard Lyon 1, Université Lumière Lyon 2, LIRIS, UMR5205, ENISE; Pierre Raimbaud: Ecole Centrale de Lyon, CNRS, INSA Lyon, Universite Claude Bernard Lyon 1, Université Lumière Lyon 2, LIRIS, UMR5205, ENISE; Guillaume Lavoué: Ecole Centrale de Lyon, CNRS, INSA Lyon, Universite Claude Bernard Lyon 1, Université Lumière Lyon 2, LIRIS, UMR5205, ENISE; Bertrand Massot: INSA Lyon, Ecole Centrale Lyon, Universite Claude Bernard Lyon 1, CPE Lyon, CNRS, INL UMR 5270",matthieu.mesnage@insa-lyon.fr; sophie.villenave@liris.cnrs.fr; pierre.raimbaud.pr@gmail.com; glavoue@liris.cnrs.fr; bertrand.massot@insa-lyon.fr
PO1016,complete,RAGatar: Enhancing LLM-driven Avatars with RAG for Knowledge-Adaptive Conversations in Virtual Reality,Alexander Marquardt,marquardt@ieee.org,,A,4,,https://0d2f0bc53ec40041bef323f40496ed3c.r2.cloudflarestorage.com/pcs/vr25c/vr25c-sub1016-cam-i5.pdf?X-Amz-Algorithm=AWS4-HMAC-SHA256&X-Amz-Expires=7200&X-Amz-Credential=8c3c5bf11286f4699c7019eaeac51dfe%2F20250203%2Fenam%2Fs3%2Faws4_request&X-Amz-SignedHeaders=host&X-Amz-Date=20250203T201551Z&X-Amz-Signature=1a501cc1d6b000c32f406f23fb36dae99ee030cd409d85aa4cc33a955731f5f0,2,letter,2025-01-23 10:03,https://0d2f0bc53ec40041bef323f40496ed3c.r2.cloudflarestorage.com/pcs/vr25c/vr25c-sub1016-cam-i18.jpg?X-Amz-Algorithm=AWS4-HMAC-SHA256&X-Amz-Expires=7200&X-Amz-Credential=8c3c5bf11286f4699c7019eaeac51dfe%2F20250203%2Fenam%2Fs3%2Faws4_request&X-Amz-SignedHeaders=host&X-Amz-Date=20250203T201551Z&X-Amz-Signature=a7504720e05d86470a44703fa3268af27904ef3ddefdb50e11558df318a10dd7,Alexander Marquardt,"We present a virtual reality system that enables users to seamlessly switch between general conversations and domain-specific knowledge retrieval through natural interactions with AI-driven avatars. By combining MetaHuman technology with self-hosted large language models and retrieval-augmented generation, our system demonstrates how immersive AI interactions can enhance learning and training applications where both general communication and expert knowledge are required.",https://youtu.be/yMbhFWAVFew,,uW6We8kgprFzyJsJ-_3qEIQ,,Alexander,,Marquardt,,marquardt@ieee.org,Bonn-Rhein-Sieg University of Applied Sciences,Institute of Visual Computing,Sankt Augustin,,Germany,,VAGO Solutions,Hennef (Sieg),,Germany,uVGSXAYvS67VFIQ3hLtSJMA,,David,,Golchinfar,,david.golchinfar@h-brs.de,,University of Applied Sciences Bonn-Rhein-Sieg,Sankt Augustin,,Germany,,VAGO Solutions,Hennef (Sieg),,Germany,u1mi0up-VPpayjakEnYBQow,Dr.,Daryoush,Daniel,Vaziri,,daryoush.vaziri@h-brs.de,Business Informatics,University of Applied Sciences,Sankt Augustin,,Germany,,VAGO Solutions,Hennef (Sieg),,Germany,,,,,,,,,,,,,,,,,,,,,,,,,,,,,,,,,,,,,,,,,,,,,,,,,,,,,,,,,,,,,,,,,,,,,,,,,,,,,,,,,,,,,,,,,,,,,,,,,,,,,,,,,,,,,,,,,,,,,,,,,,,,,,,,,,,,,,,,,,,,,,,,,,,,,,,,,,Alexander Marquardt: Institute of Visual Computing; David Golchinfar: University of Applied Sciences Bonn-Rhein-Sieg; Daryoush Daniel Vaziri: University of Applied Sciences,david.golchinfar@h-brs.de; daryoush.vaziri@h-brs.de
PO1121,complete,Demo: Automated Multiparty Conversations Analysis in VR Massive Multiplayer Online Games Environments,Dr Elio Salvadori,esalvadori@fbk.eu,,A,4.5,,https://0d2f0bc53ec40041bef323f40496ed3c.r2.cloudflarestorage.com/pcs/vr25c/vr25c-sub1121-cam-i5.pdf?X-Amz-Algorithm=AWS4-HMAC-SHA256&X-Amz-Expires=7200&X-Amz-Credential=8c3c5bf11286f4699c7019eaeac51dfe%2F20250203%2Fenam%2Fs3%2Faws4_request&X-Amz-SignedHeaders=host&X-Amz-Date=20250203T201551Z&X-Amz-Signature=408fc7c76b00335719fa5669a5924c759c70273311084855fd89df0f93665e54,2,letter,2025-01-27 14:32,,Riccardo Calcagno,"The study of social interactions in Massively Multiplayer Online Games (MMOGs) has largely focused on chat communication and speech content analysis. This paper introduces a novel tool designed to analyze social interactions among MMOG players by leveraging Conversation Analysis methodologies to systematically assess multi-party interactions during 6DOF Virtual Reality sessions. The Multiparty Conversation Analysis (MCA) tool can be applied in several MMOG contexts where social analysis is needed. In this demo paper, we present a specific application of the tool focusing on VR MMOG-based therapy for autistic teens. A video demo can be seen in: https://www.youtube.com/watch?v=U4A4vkjUrvM",https://www.youtube.com/watch?v=U4A4vkjUrvM,,u78E6Yc2ELdkyYz2VApx0cg,,Riccardo,,Calcagno,,riccardocalc7@gmail.com,,Fondazione Bruno Kessler,Trento,TN,Italy,,,,,,uHAeE5gnT3P2DHeqASh3PSA,Dr,Elio,,Salvadori,,esalvadori@fbk.eu,,Fondazione Bruno Kessler,Trento,,Italy,,,,,,uPEEKBruR8SUkafvZ08vLzA,,Oscar,,Mayora,,omayora@fbk.eu,,Fondazione Bruno Kessler Research Institute,Trento,,Italy,,,,,,uOC7D9zCrQCVDKiQAgE64TA,,Giovanna,,Varni,,giovannapaola.varni@unitn.it,DISI,University of Trento,Povo,,Italy,,,,,,um_YPwpQG-0iAFTi7kFsONQ,Dr.,Luca,,Turchet,,luca.turchet@unitn.it,Department of Information Engineering and Computer Science,University of Trento,Trento,,Italy,,,,,,,,,,,,,,,,,,,,,,,,,,,,,,,,,,,,,,,,,,,,,,,,,,,,,,,,,,,,,,,,,,,,,,,,,,,,,,,,,,,,,,,,,,,,,,,,,,,,,,,,,,,,,,,,,,,,,,,,,,,,,Riccardo Calcagno: Fondazione Bruno Kessler; Elio Salvadori: Fondazione Bruno Kessler; Oscar Mayora: Fondazione Bruno Kessler Research Institute; Giovanna Varni: University of Trento; Luca Turchet: University of Trento,rcalcagno@fbk.eu; omayora@fbk.eu; giovannapaola.varni@unitn.it; luca.turchet@unitn.it
PO1132,complete,Demo: Out-Of-Body Experience induced after Virtual Embodiment,Pierre Bourdin-Kreitz,pbourdin@uoc.edu,,A,3.5,,https://0d2f0bc53ec40041bef323f40496ed3c.r2.cloudflarestorage.com/pcs/vr25c/vr25c-sub1132-cam-i5.pdf?X-Amz-Algorithm=AWS4-HMAC-SHA256&X-Amz-Expires=7200&X-Amz-Credential=8c3c5bf11286f4699c7019eaeac51dfe%2F20250203%2Fenam%2Fs3%2Faws4_request&X-Amz-SignedHeaders=host&X-Amz-Date=20250203T201551Z&X-Amz-Signature=7a22b9cb07fadea53a5d169e00bce1300c5f2bca4be2ecd65080012adb2d4e05,2,letter,2025-01-29 23:21,https://0d2f0bc53ec40041bef323f40496ed3c.r2.cloudflarestorage.com/pcs/vr25c/vr25c-sub1132-cam-i18.png?X-Amz-Algorithm=AWS4-HMAC-SHA256&X-Amz-Expires=7200&X-Amz-Credential=8c3c5bf11286f4699c7019eaeac51dfe%2F20250203%2Fenam%2Fs3%2Faws4_request&X-Amz-SignedHeaders=host&X-Amz-Date=20250203T201551Z&X-Amz-Signature=05a6e51776c0ca184aa7a6e737388157666eea1753deac6c33d17240a612bcde,Pierre Bourdin-Kreitz and Andreu Castaño Jiménez,"Out-of-body experiences (OBEs), where individuals perceive themselves as separated from their physical bodies, hold significant potential for research in psychology and neuroscience. We present a demonstration of a system designed to induce OBEs through immersive technology and virtual body ownership illusions (VBOI). Our approach uses personalized avatars, synchronized visuomotor and visuotactile stimulation, and real-time interaction to create strong VBOI, followed by the induction of OBEs via controlled camera movements. The system is lightweight, user-friendly, and offers better ecological validity, opening new avenues for studying mind-body relationships in controlled environments. Applications include advancing research on self-consciousness, embodiment, and disembodiment, as well as exploring therapeutic interventions for conditions such as PTSD and anxiety. In future research, we wish to explore virtual OBEs in more realistic contexts, such as VR car crash scenarios.",https://youtu.be/f8Wh0VrtS4k,,uaMMBezmRhye8wAUE5F9icw,,Pierre,,Bourdin-Kreitz,,pbourdin@uoc.edu,,Universitat Oberta de Catalunya,Barcelona,,Spain,XR-Lab,Universitat Oberta de Catalunya,Barcelona,Catalunya,Spain,uyh3eneNetfCuu4wVVKvWsw,,Andreu,,Castaño Jiménez,,andreu.c.j99@gmail.com,,Universitat Pompeu Fabra,Barcelona,,Spain,XR-Lab,Universitat Oberta de Catalunya,Barcelona,Catalunya,Spain,,,,,,,,,,,,,,,,,,,,,,,,,,,,,,,,,,,,,,,,,,,,,,,,,,,,,,,,,,,,,,,,,,,,,,,,,,,,,,,,,,,,,,,,,,,,,,,,,,,,,,,,,,,,,,,,,,,,,,,,,,,,,,,,,,,,,,,,,,,,,,,,,,,,,,,,,,,,,,,,,,,,,,,,,,,Pierre Bourdin-Kreitz: Universitat Oberta de Catalunya; Andreu Castaño Jiménez: Universitat Pompeu Fabra,andreu.c.j99@gmail.com
