PO1122,complete,Virtual Reality Antarctic Weather Station Repair for Informal STEM Learning,Ross Tredinnick,rdtredinnick@wisc.edu,,A,3.5,,https://0d2f0bc53ec40041bef323f40496ed3c.r2.cloudflarestorage.com/pcs/vr25c/vr25c-sub1122-cam-i5.pdf?X-Amz-Algorithm=AWS4-HMAC-SHA256&X-Amz-Expires=7200&X-Amz-Credential=8c3c5bf11286f4699c7019eaeac51dfe%2F20250203%2Fenam%2Fs3%2Faws4_request&X-Amz-SignedHeaders=host&X-Amz-Date=20250203T201551Z&X-Amz-Signature=ee0b0a946e473acfe563c446b92c446fe742a11b7a7af5bf9b0a14492effde48,2,letter,2025-01-28 3:09,https://0d2f0bc53ec40041bef323f40496ed3c.r2.cloudflarestorage.com/pcs/vr25c/vr25c-sub1122-cam-i18.png?X-Amz-Algorithm=AWS4-HMAC-SHA256&X-Amz-Expires=7200&X-Amz-Credential=8c3c5bf11286f4699c7019eaeac51dfe%2F20250203%2Fenam%2Fs3%2Faws4_request&X-Amz-SignedHeaders=host&X-Amz-Date=20250203T201551Z&X-Amz-Signature=fbe315845ea8a15e5538c2f1d8d3d29805be4d6873a81ef99b4aade0844bcbb1,Ross Tredinnick,"Developed in collaboration with polar science experts, this virtual reality game immerses users in the life of a scientist maintaining weather stations in Antarctica. Designed for the Meta Quest 3, the game challenges players to complete realistic repair tasks reimagined as engaging tactile puzzles. As players tackle these challenges, a virtual assistant provides guidance, not only assisting with gameplay mechanics but also offering valuable insights into the real-world science behind their actions. This interactive experience aims to captivate players aged ten and above, offering a unique blend of education and entertainment.  A preview of the experience can be found at https://www.youtube.com/watch?v=cQpikAcYwek.",https://www.youtube.com/watch?v=cQpikAcYwek,,uS5rwzxVxvZPan1XFAvnSww,,Kevin,,Ponto,,kbponto@wisc.edu,Wisconsin Institute for Discovery,University of Wisconsin - Madison,Madison,Wisconsin,United States,,,,,,uNIg4evYpuRR060KvkHbFmg,,Ross,,Tredinnick,,rdtredinnick@wisc.edu,Wisconsin Institute for Discovery,University of Wisconsin - Madison,Madison,Wisconsin,United States,,,,,,uxjHCq8VuApVHokS0ZEIDkQ,M.,Sarah,J,Gagnon,,gagnon3@wisc.edu,Field Day Lab,"University of Wisconsin, Madison",Madison,Wisconsin,United States,,,,,,u0pTEgsdfuDJHF6TN7LmJeQ,,David,,Gagnon,,djgagnon@wisc.edu,Field Day Lab,University of Wisconsin,Madison,Wisconsin,United States,,,,,,,,,,,,,,,,,,,,,,,,,,,,,,,,,,,,,,,,,,,,,,,,,,,,,,,,,,,,,,,,,,,,,,,,,,,,,,,,,,,,,,,,,,,,,,,,,,,,,,,,,,,,,,,,,,,,,,,,,,,,,,,,,,,,,,,,,,,,,,"Kevin Ponto: University of Wisconsin - Madison; Ross Tredinnick: University of Wisconsin - Madison; Sarah J Gagnon: University of Wisconsin, Madison; David Gagnon: University of Wisconsin",kbponto@wisc.edu; gagnon3@wisc.edu; djgagnon@wisc.edu
PO1134,complete,Drawn Together: A Collocated Mixed Reality Sketching and Annotation Experience,Andrew Rukangu,amr07618@uga.edu,,A,3.5,,https://0d2f0bc53ec40041bef323f40496ed3c.r2.cloudflarestorage.com/pcs/vr25c/vr25c-sub1134-cam-i5.pdf?X-Amz-Algorithm=AWS4-HMAC-SHA256&X-Amz-Expires=7200&X-Amz-Credential=8c3c5bf11286f4699c7019eaeac51dfe%2F20250203%2Fenam%2Fs3%2Faws4_request&X-Amz-SignedHeaders=host&X-Amz-Date=20250203T201551Z&X-Amz-Signature=13bc93a619f2de5352b9836cb0df83591bc635ba75545dc5a119a8557d20e32b,2,letter,2025-01-27 20:18,,Andrew Rukangu,"We present Drawn Together, a 3D immersive mixed-reality sketching and annotation tool designed for collaboration research.  The system supports a variety of 3D content creation ranging from mid-air, free-form line drawing to voxel-based drawings and mannequins that can be flexibly posed.   Groups of users can engage in synchronous, collocated design, education, art, and play aligned against a pass-through video backdrop to afford physical references and annotations.  A number of input options are also presented, including standard motion controllers, a tracked stylus, and ring-augmented hand tracking.",https://youtu.be/gTKL5lChgao,,udVp31KwdAfTiJLJau_JJww,,Andrew,,Rukangu,,amr07618@uga.edu,School of Electrical and Computer Engineering,University of Georgia,Athens,Georgia,United States,,,,,,uoWrjPtkqBCZua_VekRhVQw,,Ethan,C,Bowmar,,ecb78379@uga.edu,College of Engineering,University of Georgia,Athens,Georgia,United States,,,,,,uC2tXD85mpgXSs3zliToD8Q,,Sun Joo (Grace),,Ahn,,sjahn@uga.edu,Grady College of Journalism and Mass Communication,University of Georgia,Athens,Georgia,United States,,,,,,ul3O5sLehJcKCSSCOqkEMgQ,,Beshoy,,Morkos,,bmorkos@uga.edu,College of Engineering,University of Georgia,Athens,Georgia,United States,,,,,,uHhCHlbXtl7LWc9qc-H671w,,Kyle,,Johnsen,,kjohnsen@uga.edu,School of Electrical and Computer Engineering,University of Georgia,Athens,Georgia,United States,,,,,,,,,,,,,,,,,,,,,,,,,,,,,,,,,,,,,,,,,,,,,,,,,,,,,,,,,,,,,,,,,,,,,,,,,,,,,,,,,,,,,,,,,,,,,,,,,,,,,,,,,,,,,,,,,,,,,,,,,,,,,Andrew Rukangu: University of Georgia; Ethan C Bowmar: University of Georgia; Sun Joo (Grace) Ahn: University of Georgia; Beshoy Morkos: University of Georgia; Kyle Johnsen: University of Georgia,ecb78379@uga.edu; sjahn@uga.edu; bmorkos@uga.edu; kjohnsen@uga.edu
PO1064,complete,LLM-powered Text Entry in Virtual Reality,Yan Ma,yanma1@cs.stonybrook.edu,,A,3.5,,https://0d2f0bc53ec40041bef323f40496ed3c.r2.cloudflarestorage.com/pcs/vr25c/vr25c-sub1064-cam-i5.pdf?X-Amz-Algorithm=AWS4-HMAC-SHA256&X-Amz-Expires=7200&X-Amz-Credential=8c3c5bf11286f4699c7019eaeac51dfe%2F20250203%2Fenam%2Fs3%2Faws4_request&X-Amz-SignedHeaders=host&X-Amz-Date=20250203T201551Z&X-Amz-Signature=7e7a57d8a5dda5612e709158cd9465ca9a60d7d56206418b2d84d5f2c78ee188,2,letter,2025-01-25 4:23,https://0d2f0bc53ec40041bef323f40496ed3c.r2.cloudflarestorage.com/pcs/vr25c/vr25c-sub1064-cam-i18.png?X-Amz-Algorithm=AWS4-HMAC-SHA256&X-Amz-Expires=7200&X-Amz-Credential=8c3c5bf11286f4699c7019eaeac51dfe%2F20250203%2Fenam%2Fs3%2Faws4_request&X-Amz-SignedHeaders=host&X-Amz-Date=20250203T201551Z&X-Amz-Signature=ce77d4137f711d7d418be7cd9ca69adee31ce9e0aa044e74d4335ce6af5b1d19,Tony Li,"Large language models (LLMs) have demonstrated exceptional performance across various language-related tasks, offering significant potential for enhancing text entry in Virtual Reality (VR). We introduce an LLM-powered text entry system for VR, which integrates multiple input modalities and utilizes a fine-tuned LLM as a keyboard decoder. The LLM-based decoder achieved 93.1% top-1 decoding accuracy on a word gesture typing dataset and 95.4% on tap typing, highlighting its potential for VR text entry applications. Our demonstration shows how LLMs can support tap typing and word-gesture typing through raycasting and joystick-based inputs, potentially accommodating various user preferences and enhancing the adaptability of VR text input methods.",https://www.youtube.com/watch?v=YMORsSqYLtU,,uQLuZHdrvdM9y0gGSk-pZyQ,,Yan,,Ma,,yanma1@cs.stonybrook.edu,Computer Science Department,Stony Brook University,Stony Brook,New York,United States,,,,,,uO7xengAO5ekrnGjLvMrBDg,,Tony,,Li,,haolili@cs.stonybrook.edu,Department of Computer Science,Stony Brook University,Stony Brook,New York,United States,,,,,,uzuhOkA1AlSRPreaZ7fK1eQ,,Zhi,,Li,,zhili3@cs.stonybrook.edu,Department of Computer Science,Stony Brook University,Stony Brook,New York,United States,,,,,,uAZWfQJ4jhasJTzfH7Mo74g,,Xiaojun,,Bi,,xiaojun@cs.stonybrook.edu,Department of Computer Science,Stony Brook University,Stony Brook,New York,United States,,,,,,,,,,,,,,,,,,,,,,,,,,,,,,,,,,,,,,,,,,,,,,,,,,,,,,,,,,,,,,,,,,,,,,,,,,,,,,,,,,,,,,,,,,,,,,,,,,,,,,,,,,,,,,,,,,,,,,,,,,,,,,,,,,,,,,,,,,,,,,Yan Ma: Stony Brook University; Tony Li: Stony Brook University; Zhi Li: Stony Brook University; Xiaojun Bi: Stony Brook University,haolili@cs.stonybrook.edu; zhili3@cs.stonybrook.edu; xiaojun@cs.stonybrook.edu
PO1074,complete,From 2D to 3D: Redesigning the Desktop Metaphor in Virtual Reality,Mingzhu Cui,chlaudwn93@yonsei.ac.kr,,A,4.5,,https://0d2f0bc53ec40041bef323f40496ed3c.r2.cloudflarestorage.com/pcs/vr25c/vr25c-sub1074-cam-i5.pdf?X-Amz-Algorithm=AWS4-HMAC-SHA256&X-Amz-Expires=7200&X-Amz-Credential=8c3c5bf11286f4699c7019eaeac51dfe%2F20250203%2Fenam%2Fs3%2Faws4_request&X-Amz-SignedHeaders=host&X-Amz-Date=20250203T201551Z&X-Amz-Signature=38a1a409071937d0639bb10cab0c794fce3508746b1b4c8a23d5a95d794a2784,2,letter,2025-01-27 7:12,https://0d2f0bc53ec40041bef323f40496ed3c.r2.cloudflarestorage.com/pcs/vr25c/vr25c-sub1074-cam-i18.jpg?X-Amz-Algorithm=AWS4-HMAC-SHA256&X-Amz-Expires=7200&X-Amz-Credential=8c3c5bf11286f4699c7019eaeac51dfe%2F20250203%2Fenam%2Fs3%2Faws4_request&X-Amz-SignedHeaders=host&X-Amz-Date=20250203T201551Z&X-Amz-Signature=7f6e0abc5cdc43782c32e8456c286cc45a60735941ffeeeefe2d6c52b39acef4,Mingzhu Cui,"Since the 1980s, scholars have proposed Natural User Interfaces (NUI) as the future of interaction, with VR HMD technology making 3D environments and hand gestures feasible. However, much of today’s VR research focuses on algorithms or conceptual ideas, and industry solutions often extend traditional 2D WIMP GUIs. In response, this study presents a new VR desktop paradigm incorporating object, metaphor, physics, embodiment, spatial context, and magic. A prototype featuring a music player and calculator demonstrated high usability and immersion.Moreover, workspace customization emerges as a valuable feature for personalization, yielding positive outcomes in terms of spatial memory and task re-immersion. This underscores the potential of VR interfaces to offer not only novel interaction techniques but also enhanced cognitive and experiential benefits for users, suggesting avenues for future research on broader applications.",https://youtu.be/lPk4ShbOXrI,,urwZDO3WElmhP2CBQPA25Xw,,Mingzhu,,Cui,,chlaudwn93@yonsei.ac.kr,,Yonsei University,Seoul,,"Korea, Republic of"," Department of Human Environment & Design,  Department of Human Life & Innovation Design",Yonsei University,Seoul,,"Korea, Republic of",uHlbqF-lCVngSAokykRjI4Q,,Sangwon,,Lee,,sangwon.lee@yonsei.ac.kr,,Yonsei University,Seoul,,"Korea, Republic of",,,,,,uIuliOmEXm8sPFrgFri57uA,,Junyoung,,Kim,,jykim0418@yonsei.ac.kr,,Yonsei University,Seoul,,"Korea, Republic of",,,,,,,,,,,,,,,,,,,,,,,,,,,,,,,,,,,,,,,,,,,,,,,,,,,,,,,,,,,,,,,,,,,,,,,,,,,,,,,,,,,,,,,,,,,,,,,,,,,,,,,,,,,,,,,,,,,,,,,,,,,,,,,,,,,,,,,,,,,,,,,,,,,,,,,,,,,,,,,Mingzhu Cui: Yonsei University; Sangwon Lee: Yonsei University; Junyoung Kim: Yonsei University,sangwon.lee@yonsei.ac.kr; jykim0418@yonsei.ac.kr
PO1116,complete,Room Connection Techniques in Virtual Reality for Walking in Impossible Spaces,Ana Rita Rebelo,ar.rebelo@campus.fct.unl.pt,,A,4,,https://0d2f0bc53ec40041bef323f40496ed3c.r2.cloudflarestorage.com/pcs/vr25c/vr25c-sub1116-cam-i5.pdf?X-Amz-Algorithm=AWS4-HMAC-SHA256&X-Amz-Expires=7200&X-Amz-Credential=8c3c5bf11286f4699c7019eaeac51dfe%2F20250203%2Fenam%2Fs3%2Faws4_request&X-Amz-SignedHeaders=host&X-Amz-Date=20250203T201551Z&X-Amz-Signature=3e36bb72f5eaf9edf3938a5a3a2c98d9723060368ca00fdc9c59969f4706f541,2,letter,2025-01-28 11:05,https://0d2f0bc53ec40041bef323f40496ed3c.r2.cloudflarestorage.com/pcs/vr25c/vr25c-sub1116-cam-i18.png?X-Amz-Algorithm=AWS4-HMAC-SHA256&X-Amz-Expires=7200&X-Amz-Credential=8c3c5bf11286f4699c7019eaeac51dfe%2F20250203%2Fenam%2Fs3%2Faws4_request&X-Amz-SignedHeaders=host&X-Amz-Date=20250203T201551Z&X-Amz-Signature=c47bd9ca78ffeb385b4fb6abbc018128d6a00c938dd7938643b71baed1e8e36d,Ana Rita Rebelo,"This work demonstrates three room-connection techniques – portals, corridors, and central hubs – that can be used in virtual environments to create ""impossible spaces"". These spaces use overlapping areas to maximize available physical space, enabling walking even in constrained spaces. In this experiment, a user can navigate through a five-room apartment of about 106.25 m² by walking within a physical play area of about 6.25 m² (2.5 x 2.5 meters).  The primary contribution of this work is demonstrating how these room-connection techniques can be applied to dynamically adapt virtual environments to fit small physical spaces, such as those commonly available to VR users at home. A video showcasing this demo can be found at the following link: https://youtu.be/a_4kcC0VOuY.",https://youtu.be/a_4kcC0VOuY,,uZlojOwr0EcHdrGANxPknJA,,Ana,Rita,Rebelo,,ar.rebelo@campus.fct.unl.pt,,"NOVA LINCS, NOVA School of Science and Technology",Lisbon,,Portugal,,,,,,uZw9TyrUgk5qlrG0VNfP3-A,,Pedro A.,,Ferreira,,pan.ferreira@campus.fct.unl.pt,NOVA LINCS,NOVA School of Science and Technology,Lisbon,,Portugal,,,,,,ul00qgNqyxDhr8ocdP_-Ndw,,Rui,,Nóbrega,,rui.nobrega@fct.unl.pt,"NOVA-LINCS, DI","Faculdade de Ciências e Tecnologia, Universidade Nova de Lisboa",Caparica,,Portugal,,,,,,,,,,,,,,,,,,,,,,,,,,,,,,,,,,,,,,,,,,,,,,,,,,,,,,,,,,,,,,,,,,,,,,,,,,,,,,,,,,,,,,,,,,,,,,,,,,,,,,,,,,,,,,,,,,,,,,,,,,,,,,,,,,,,,,,,,,,,,,,,,,,,,,,,,,,,,,,"Ana Rita Rebelo: NOVA LINCS, NOVA School of Science and Technology; Pedro A. Ferreira: NOVA School of Science and Technology; Rui Nóbrega: Faculdade de Ciências e Tecnologia, Universidade Nova de Lisboa",pan.ferreira@campus.fct.unl.pt; rui.nobrega@fct.unl.pt
PO1114,complete,Interoperable and Open Source Solution for Anchoring Augmented Reality Content to the Real World,Jérémy Lacoche,jeremy.lacoche@orange.com,,A,4,,https://0d2f0bc53ec40041bef323f40496ed3c.r2.cloudflarestorage.com/pcs/vr25c/vr25c-sub1114-cam-i5.pdf?X-Amz-Algorithm=AWS4-HMAC-SHA256&X-Amz-Expires=7200&X-Amz-Credential=8c3c5bf11286f4699c7019eaeac51dfe%2F20250203%2Fenam%2Fs3%2Faws4_request&X-Amz-SignedHeaders=host&X-Amz-Date=20250203T201551Z&X-Amz-Signature=b4999e8c6cfaeea9998cd6cb48b6bea12c2cd22f0b180cf9d83b4a28b3e6d483,2,letter,2025-01-27 16:42,https://0d2f0bc53ec40041bef323f40496ed3c.r2.cloudflarestorage.com/pcs/vr25c/vr25c-sub1114-cam-i18.png?X-Amz-Algorithm=AWS4-HMAC-SHA256&X-Amz-Expires=7200&X-Amz-Credential=8c3c5bf11286f4699c7019eaeac51dfe%2F20250203%2Fenam%2Fs3%2Faws4_request&X-Amz-SignedHeaders=host&X-Amz-Date=20250203T201551Z&X-Amz-Signature=a6e593d071b515bfe418e7da28d2bffcc9899134c109723272c5988ee96dd6d2,Jérémy Lacoche,"This research demonstration presents an open source end-to-end solution for facilitating the anchoring of virtual content in the real world based on various platforms thanks to the interoperable specifications of the ETSI Augmented Reality Framework (ARF) Industry Specification Group (ISG). The solution relies on authoring tools developed for Unity and the created AR applications can be deployed on platforms such as iOS, Android and VisionOS. A validation scenario for data center maintenance is detailed to illustrate the solution. Various examples based on the glTF format are also provided to show the potential of this novel architecture.",https://www.youtube.com/watch?v=wxqSAIa4mVg,,unLHJFxvoOuFyH2Xsg6uXsA,,Sylvain,,Buche,,buche.sylvain@gmail.com,,Orange Labs,Rennes,,France,,,,,,utOrK1vtL9rVhDidbGvOsSQ,,Ingo,,Feldmann,,ingo.feldmann@hhi.fraunhofer.de,Vision & Imaging Technologies,Fraunhofer HHI,Berlin,,Germany,,,,,,utuLKbPEYPMgVHlt8kmzoIQ,Prof. Dr.,Patrick,,Harms,,patrick.harms@th-nuernberg.de,efi,Nuremberg Institute of Technology,Nuremberg,,Germany,,,,,,uLmt3c_O9B4xkMB7NXQ0ZDQ,,Hugo,,Kréber,,hugo.kreber@b-com.com,,IRT b<>com,Cesson Sévigné,,France,,,,,,uJfw4nOf3l749TBrKj0wxjQ,,Jérémy,,Lacoche,,jeremy.lacoche@orange.com,,Orange Labs,Rennes,,France,,,,,,uD3S4Cjw892U1Y5-dVlww0g,,Stéphane Louis Dit,,Picard,,stephane.louisditpicard@orange.com,,Orange,Rennes,,France,,,,,,u0gYze9DobGSXNPFP605XzQ,,Sylvain,,Renault,,sylvain.renault@hhi.fraunhofer.de,,Fraunhofer Heinrich-Hertz-Institut,Berlin,,Germany,,,,,,uSp4Fv0Ys--6QrYBOt_jXwg,,Jérôme,,Royan,,jerome.royan@b-com.com,,IRT b<>com,Rennes,,France,,,,,,,,,,,,,,,,,,,,,,,,,,,,,,,,,,,,,,,,,,,,,,,,,,,,,,,,,,,,,,,,,,,,,,,,,,Sylvain Buche: Orange Labs; Ingo Feldmann: Fraunhofer HHI; Patrick Harms: Nuremberg Institute of Technology; Hugo Kréber: IRT b<>com; Jérémy Lacoche: Orange Labs; Stéphane Louis Dit Picard: Orange; Sylvain Renault: Fraunhofer Heinrich-Hertz-Institut; Jérôme Royan: IRT b<>com,buche.sylvain@gmail.com; ingo.feldmann@hhi.fraunhofer.de; patrick.harms@th-nuernberg.de; hugo.kreber@b-com.com; stephane.louisditpicard@orange.com; sylvain.renault@hhi.fraunhofer.de; jerome.royan@b-com.com
PO1137,complete,Focus360: Guiding User Attention in Immersive Videos for VR,Paulo Vitor Santana da Silva,paulovitor_pe@hotmail.com,,A,3.5,,https://0d2f0bc53ec40041bef323f40496ed3c.r2.cloudflarestorage.com/pcs/vr25c/vr25c-sub1137-cam-i5.pdf?X-Amz-Algorithm=AWS4-HMAC-SHA256&X-Amz-Expires=7200&X-Amz-Credential=8c3c5bf11286f4699c7019eaeac51dfe%2F20250203%2Fenam%2Fs3%2Faws4_request&X-Amz-SignedHeaders=host&X-Amz-Date=20250203T201551Z&X-Amz-Signature=c2c86c2959742d5ae0572303fe656a28ae0a5623966a5fa6a23abc38a8c6d0ad,2,letter,2025-01-27 22:03,,Paulo Vitor Santana da Silva,"This demo introduces Focus360, a system designed to enhance user engagement in 360º VR videos by guiding attention to key elements within the scene. Using natural language descriptions, the system identifies important elements and applies a combination of visual effects to guide attention seamlessly. At the demonstration venue, participants can experience a 360º Safari Tour, showcasing the system's ability to improve user focus while maintaining an immersive experience.",https://youtu.be/PSNaqcoIgDY,,ukVTlhlFTODLtdsH8lgbfzA,,Paulo Vitor,,Santana da Silva,,paulovitor_pe@hotmail.com,,Advanced Knowledge Center in Immersive Technologies (AKCIT),Goiânia,Goiás,Brazil,,,,,,uWGtZE_TKgW_Vn-aUqDBY3w,,Lucas Lima,,Neves,,lucas.neves@discente.ufg.br,,Advanced Knowledge Center in Immersive Technologies (AKCIT),Goiânia,Goiás,Brazil,,,,,,ufXJ7uCNKl1NSPc1BgzGGNw,,Rafael Alves,,Goiás,,rafael_goias@discente.ufg.br,,Advanced Knowledge Center in Immersive Technologies (AKCIT),Goiânia,Goiás,Brazil,,,,,,ukdSB1FXjwVc0OIL7WeHpOA,,Diogo,,Fernandes,,diiogofernands@gmail.com,,Advanced Knowledge Center in Immersive Technologies (AKCIT),Goiânia,Goiás,Brazil,,,,,,u49Ukvu1BblSXSBCnoUiigA,Dr.,Rafael,Teixeira,Sousa,,rafaelsousa@ufmt.br,,Advanced Knowledge Center in Immersive Technologies (AKCIT),Goiânia,Goiás,Brazil,,,,,,uHgKg503BXHgmjEr4uXNl_A,,ARLINDO,,GALVÃO,,arlindogalvao@ufg.br,,Advanced Knowledge Center in Immersive Technologies (AKCIT),Goiânia,Goiás,Brazil,,,,,,,,,,,,,,,,,,,,,,,,,,,,,,,,,,,,,,,,,,,,,,,,,,,,,,,,,,,,,,,,,,,,,,,,,,,,,,,,,,,,,,,,,,,,,,,,,,,,,,,,,,,,Paulo Vitor Santana da Silva: Advanced Knowledge Center in Immersive Technologies (AKCIT); Lucas Lima Neves: Advanced Knowledge Center in Immersive Technologies (AKCIT); Rafael Alves Goiás: Advanced Knowledge Center in Immersive Technologies (AKCIT); Diogo Fernandes: Advanced Knowledge Center in Immersive Technologies (AKCIT); Rafael Teixeira Sousa: Advanced Knowledge Center in Immersive Technologies (AKCIT); ARLINDO GALVÃO: Advanced Knowledge Center in Immersive Technologies (AKCIT),lucas.neves@discente.ufg.br; rafael_goias@discente.ufg.br; diiogofernands@gmail.com; rafaelsousa@ufmt.br; arlindogalvao@ufg.br
PO1093,complete,Multi-resolution audiovisual representation of sound fields recorded with a 7th-order ambisonic microphone array.,Francois Salmon,francois.salmon@noisemakers.fr,,A,5,,https://0d2f0bc53ec40041bef323f40496ed3c.r2.cloudflarestorage.com/pcs/vr25c/vr25c-sub1093-cam-i5.pdf?X-Amz-Algorithm=AWS4-HMAC-SHA256&X-Amz-Expires=7200&X-Amz-Credential=8c3c5bf11286f4699c7019eaeac51dfe%2F20250203%2Fenam%2Fs3%2Faws4_request&X-Amz-SignedHeaders=host&X-Amz-Date=20250203T201551Z&X-Amz-Signature=7e7bc1f982b92f93ba6baa36266ac20da1409665305f3840033b5b952885c1b5,2,letter,2025-01-28 9:43,,François Salmon,"As part of the development of an ambisonic microphone array, it is of interest to determine the spatial accuracy required to capture and reproduce a sound field over headphones. A 7th order ambisonic microphone array consisting of 480 MEMs has been developed to capture sound fields with high resolution. This research demonstration allows us to experience the drawbacks of reducing the spatial accuracy of an ambisonic representation obtained with such a prototype. It allows to listen to the captured sound field at different resolutions and to visualise the resulting accuracy in terms of energy over the sphere. The visual information is overlaid on 360 videos to help identify the sound sources around the listener. Such development can find applications in the context of remote monitoring and will enable the study of interactions between auditory and visual cues in the context of Virtual Reality experiences.",https://www.youtube.com/watch?v=lcConBLXJDc,,u_qSr3nuOf5fYXn-FWtAdxA,,Francois,,Salmon,,francois.salmon@noisemakers.fr,,Noise Makers,Rennes,,France,,,,,,,,,,,,,,,,,,,,,,,,,,,,,,,,,,,,,,,,,,,,,,,,,,,,,,,,,,,,,,,,,,,,,,,,,,,,,,,,,,,,,,,,,,,,,,,,,,,,,,,,,,,,,,,,,,,,,,,,,,,,,,,,,,,,,,,,,,,,,,,,,,,,,,,,,,,,,,,,,,,,,,,,,,,,,,,,,,,,,,,,,,,,,,,,,Francois Salmon: Noise Makers,
PO1012,complete,Vision Language Model-Based Solution for Obstruction Attack in AR: A Meta Quest 3 Implementation,Yanming Xiu,yanming.xiu@duke.edu,,A,3.5,,https://0d2f0bc53ec40041bef323f40496ed3c.r2.cloudflarestorage.com/pcs/vr25c/vr25c-sub1012-cam-i5.pdf?X-Amz-Algorithm=AWS4-HMAC-SHA256&X-Amz-Expires=7200&X-Amz-Credential=8c3c5bf11286f4699c7019eaeac51dfe%2F20250203%2Fenam%2Fs3%2Faws4_request&X-Amz-SignedHeaders=host&X-Amz-Date=20250203T201551Z&X-Amz-Signature=348659ca6b3f0e3ae4f98d1ea9119cde12796199e6837b70b54e2df259073d45,2,letter,2025-01-28 17:02,,Yanming Xiu,"Obstruction attacks in Augmented Reality (AR) pose significant challenges by obscuring critical real-world objects. This work demonstrates the first implementation of obstruction detection on a video see-through head-mounted display (HMD), the Meta Quest 3. Leveraging a vision language models (VLM) and a multi-modal object detection model, our system detects obstructions by analyzing both raw and augmented images. Due to limited access to raw camera feeds, the system employs an image-capturing approach using Oculus casting, capturing a sequence of images and finding the raw image from them. Our implementation showcases the feasibility of effective obstruction detection in AR environments and highlights future opportunities for improving real-time detection through enhanced camera access.",https://youtu.be/ll1N261nVVA?si=RTftB5cHC6--xtvf,,uZ0apIE5oFaB-AO9yLMdvtg,,Yanming,,Xiu,,yanming.xiu@duke.edu,Department of Electrical and Computer Engineering,Duke University,Durham,North Carolina,United States,,,,,,u9adB1yG_0DQqUvt8UxcNPA,,Maria,,Gorlatova,,maria.gorlatova@duke.edu,Electrical and Computer Engineering,Duke University,DURHAM,North Carolina,United States,,,,,,,,,,,,,,,,,,,,,,,,,,,,,,,,,,,,,,,,,,,,,,,,,,,,,,,,,,,,,,,,,,,,,,,,,,,,,,,,,,,,,,,,,,,,,,,,,,,,,,,,,,,,,,,,,,,,,,,,,,,,,,,,,,,,,,,,,,,,,,,,,,,,,,,,,,,,,,,,,,,,,,,,,,,,,,,,Yanming Xiu: Duke University; Maria Gorlatova: Duke University,maria.gorlatova@duke.edu
PO1096,complete,Using Virtual Reality to Raise Awareness of Communication Challenges Faced by Individuals with Hearing Loss,Joanna Luberadzka,joanna.luberadzka@eurecat.org,,A,3.5,,https://0d2f0bc53ec40041bef323f40496ed3c.r2.cloudflarestorage.com/pcs/vr25c/vr25c-sub1096-cam-i5.pdf?X-Amz-Algorithm=AWS4-HMAC-SHA256&X-Amz-Expires=7200&X-Amz-Credential=8c3c5bf11286f4699c7019eaeac51dfe%2F20250203%2Fenam%2Fs3%2Faws4_request&X-Amz-SignedHeaders=host&X-Amz-Date=20250203T201551Z&X-Amz-Signature=363946c72681fc4954b3b18a41d7134f68e9cd18f24746b3901af01c5b7c13e5,2,letter,2025-01-28 18:14,https://0d2f0bc53ec40041bef323f40496ed3c.r2.cloudflarestorage.com/pcs/vr25c/vr25c-sub1096-cam-i18.png?X-Amz-Algorithm=AWS4-HMAC-SHA256&X-Amz-Expires=7200&X-Amz-Credential=8c3c5bf11286f4699c7019eaeac51dfe%2F20250203%2Fenam%2Fs3%2Faws4_request&X-Amz-SignedHeaders=host&X-Amz-Date=20250203T201551Z&X-Amz-Signature=8778be3a1c02ee553537e00c3bbd15f8fe3dc8d6f18f3df602fbbab5d9b95652,Joanna Luberadzka,"Hearing loss is typically managed with hearing aids, which amplify sound based on the user's hearing profile. However, unlike glasses for vision, hearing aids cannot address the reduced time-frequency resolution of the auditory system. To raise awareness of the challenges faced by hearing aid users, particularly in complex acoustic environments, we use virtual reality (VR). We integrate hearing loss and hearing aid simulators into a VR application, allowing users to experience the altered soundscape in an immersive way.",https://www.youtube.com/watch?v=NTBqjj3_SLY,,uFGSd0jc8yU7hXueOLja7dA,,Joanna,,Luberadzka,,joanna.luberadzka@eurecat.org,Multimedia Technology,Eurecat,Barcelona,,Spain,,,,,,uvs6g95Ir62jRGRFegW__vg,,Enric,,Guso,,enric.guso@eurecat.org,Multimedia Technology,Eurecat,Barcelona,Barcelona,Spain,,University Pompeu Fabra,Barcelona,Barcelona,Spain,un2lPviJGUZ4elYEL9ROr4g,,Umut,,Sayin,,umut.sayin@eurecat.org,Multimedia Technology,Eurecat,Barcelona,Barcelona,Spain,,,,,,uzsbasVhlKbLo3K4i_kFWYQ,,Adan,,Garriga,,adan.garriga@eurecat.org,Multimedia Technology,Eurecat,Barcelona,Barcelona,Spain,,,,,,,,,,,,,,,,,,,,,,,,,,,,,,,,,,,,,,,,,,,,,,,,,,,,,,,,,,,,,,,,,,,,,,,,,,,,,,,,,,,,,,,,,,,,,,,,,,,,,,,,,,,,,,,,,,,,,,,,,,,,,,,,,,,,,,,,,,,,,,Joanna Luberadzka: Eurecat; Enric Guso: Eurecat; Umut Sayin: Eurecat; Adan Garriga: Eurecat,enric.guso@eurecat.org; umut.sayin@eurecat.org; adan.garriga@eurecat.org
