PO1139,complete,Designing Fractal Expressions for Immersive Aesthetic Experiences,Christian Geiger,geiger@hs-duesseldorf.de,,A,4,,https://0d2f0bc53ec40041bef323f40496ed3c.r2.cloudflarestorage.com/pcs/vr25c/vr25c-sub1139-cam-i5.pdf?X-Amz-Algorithm=AWS4-HMAC-SHA256&X-Amz-Expires=7200&X-Amz-Credential=8c3c5bf11286f4699c7019eaeac51dfe%2F20250203%2Fenam%2Fs3%2Faws4_request&X-Amz-SignedHeaders=host&X-Amz-Date=20250203T201551Z&X-Amz-Signature=30a893ef9870f3d58b99913b3aa08fee033eb994a94834e8511de39c33e18353,2,letter,2025-01-28 21:01,https://0d2f0bc53ec40041bef323f40496ed3c.r2.cloudflarestorage.com/pcs/vr25c/vr25c-sub1139-cam-i18.png?X-Amz-Algorithm=AWS4-HMAC-SHA256&X-Amz-Expires=7200&X-Amz-Credential=8c3c5bf11286f4699c7019eaeac51dfe%2F20250203%2Fenam%2Fs3%2Faws4_request&X-Amz-SignedHeaders=host&X-Amz-Date=20250203T201551Z&X-Amz-Signature=904dbcaa3f8654a47d38675525a3c4e49f23f5d148baf5e21e70ec04688ce384,Christian Geiger / Emil Gerhardt,"Aesthetic experiences are closely related to human emotions and experiences as well as the perception of aesthetic objects and phenomena. We consider interaction with generated immersive worlds to be an immersive aesthetic experience if it is designed independently of any functional use and can be experienced in an aesthetically pleasing way. The possibilities of generative techniques such as AI and other algorithms and visualization through the integration of virtual reality open up new aesthetic possibilities. We present the results of a collaboration between scientists and designers/artists in the development of a framework for three-dimensional fractals [5] and its application in various scenarios in the field of festivals, performances and exhibitions.",https://vimeo.com/1046353499,,uEtkCFakxEierJ2kUM6luqA,,Christian,,Geiger,,geiger@hs-duesseldorf.de,MIREVI Lab,University of Applied Sciences Duesseldorf,Düsseldorf,Bitte Auswählen,Germany,,,,,,uFeBwgOI8gVO7eowSQhonSA,,Emil,,Gerhardt,,emil.gerhardt@hs-duesseldorf.de,MIREVI Lab,University of Applied Sciences Duesseldorf,Düsseldorf,,Germany,,,,,,ujKRDznUDkSYbctTtxNE8cg,,Mitja,,Säger,,mitja.saeger@hs-duesseldorf.de,MIREVI Lab,University of Applied Sciences Duesseldorf,Düsseldorf,Bitte Auswählen,Germany,,,,,,,,,,,,,,,,,,,,,,,,,,,,,,,,,,,,,,,,,,,,,,,,,,,,,,,,,,,,,,,,,,,,,,,,,,,,,,,,,,,,,,,,,,,,,,,,,,,,,,,,,,,,,,,,,,,,,,,,,,,,,,,,,,,,,,,,,,,,,,,,,,,,,,,,,,,,,,,Christian Geiger: University of Applied Sciences Duesseldorf; Emil Gerhardt: University of Applied Sciences Duesseldorf; Mitja Säger: University of Applied Sciences Duesseldorf,emil.gerhardt@hs-duesseldorf.de; mitja.saeger@hs-duesseldorf.de
PO1135,complete,XiloVR: Simulation for Teaching and Technique Preservation,Alyson Souza,alysonmatheus@gmail.com,,A,4,,https://0d2f0bc53ec40041bef323f40496ed3c.r2.cloudflarestorage.com/pcs/vr25c/vr25c-sub1135-cam-i5.pdf?X-Amz-Algorithm=AWS4-HMAC-SHA256&X-Amz-Expires=7200&X-Amz-Credential=8c3c5bf11286f4699c7019eaeac51dfe%2F20250203%2Fenam%2Fs3%2Faws4_request&X-Amz-SignedHeaders=host&X-Amz-Date=20250203T201551Z&X-Amz-Signature=465fe81d056253e8b152dcea967be640fab4493dca6614b3b99e85d92798da58,2,letter,2025-01-29 2:48,https://0d2f0bc53ec40041bef323f40496ed3c.r2.cloudflarestorage.com/pcs/vr25c/vr25c-sub1135-cam-i18.png?X-Amz-Algorithm=AWS4-HMAC-SHA256&X-Amz-Expires=7200&X-Amz-Credential=8c3c5bf11286f4699c7019eaeac51dfe%2F20250203%2Fenam%2Fs3%2Faws4_request&X-Amz-SignedHeaders=host&X-Amz-Date=20250203T201551Z&X-Amz-Signature=3a2171bfd35751e60b5d9de19850019d8e7b97e5fc9b690f8017f56982d8549f,Alyson Souza,"This demonstration introduces a novel approach to exploring the art of woodcut printing through an interactive Virtual Reality (VR) environment, leveraging the educational potential of immersive technologies to promote art and culture. In this context, we developed a physical prototype designed to replace the primary functionalities of hand-based user interaction typically performed with VR controllers. Instead, the system utilizes representations of woodcut production tools, tracked by a sensor, to enable interaction within the immersive environment. The system aims to provide a practical, educational, and immersive experience in artistic creation, innovating teaching methodologies and ensuring the preservation of woodcut printing knowledge for future generations. By combining physical and digital elements, this solution bridges technological accessibility with cultural heritage promotion, offering an engaging and transformative learning platform.",https://youtu.be/p5fJbtrTVnU,,uvCsSRPAzyKl6_2HxlgQCkA,,Samuel,,Costa,,samuel.costa.705@ufrn.edu.br,Digital Metropolis Institute,Federal University of Rio Grande do Norte,Natal,RN,Brazil,,,,,,udb9DIxw3nztghhbsA6XRxQ,,Bianca,,Miranda,,miranda.bianca41@gmail.com,Digital Metropolis Institute,Federal University of Rio Grande do Norte,Natal,RN,Brazil,,,,,,uDGI480yxaOMshRftKec7QA,,Stefane,,de Assis Orichuela,,stefaneassisori@gmail.com,Digital Metropolis Institute,Federal University of Rio Grande do Norte,Natal,,Brazil,,,,,,upAWo6OBdyGmPYBYRBCI9cw,,Alyson,,Souza,,alysonmatheus@gmail.com,Digital Metropolis Institute,Federal University of Rio Grande do Norte,Natal,RN,Brazil,AKCIT/IMD,Federal University of Rio Grande do Norte,Natal,,Brazil,,,,,,,,,,,,,,,,,,,,,,,,,,,,,,,,,,,,,,,,,,,,,,,,,,,,,,,,,,,,,,,,,,,,,,,,,,,,,,,,,,,,,,,,,,,,,,,,,,,,,,,,,,,,,,,,,,,,,,,,,,,,,,,,,,,,,,,,,Samuel Costa: Federal University of Rio Grande do Norte; Bianca Miranda: Federal University of Rio Grande do Norte; Stefane de Assis Orichuela: Federal University of Rio Grande do Norte; Alyson Souza: Federal University of Rio Grande do Norte,samuel.costa.705@ufrn.edu.br; miranda.bianca41@gmail.com; stefaneassisori@gmail.com
PO1090,complete,My Co-worker ChatGPT: Development of an XR Application for Embodied Artificial Intelligence in Work Environments,Philipp Krop,philipp.krop@uni-wuerzburg.de,,A,4,,https://0d2f0bc53ec40041bef323f40496ed3c.r2.cloudflarestorage.com/pcs/vr25c/vr25c-sub1090-cam-i5.pdf?X-Amz-Algorithm=AWS4-HMAC-SHA256&X-Amz-Expires=7200&X-Amz-Credential=8c3c5bf11286f4699c7019eaeac51dfe%2F20250203%2Fenam%2Fs3%2Faws4_request&X-Amz-SignedHeaders=host&X-Amz-Date=20250203T201551Z&X-Amz-Signature=b1b593e329a8f0cc422520fee2810aba3fcc8d85c4ac76d2b4217efea51f41c1,2,letter,2025-01-27 10:03,https://0d2f0bc53ec40041bef323f40496ed3c.r2.cloudflarestorage.com/pcs/vr25c/vr25c-sub1090-cam-i18.png?X-Amz-Algorithm=AWS4-HMAC-SHA256&X-Amz-Expires=7200&X-Amz-Credential=8c3c5bf11286f4699c7019eaeac51dfe%2F20250203%2Fenam%2Fs3%2Faws4_request&X-Amz-SignedHeaders=host&X-Amz-Date=20250203T201551Z&X-Amz-Signature=aae20746722460ae7901a29f7381d88358b73df2482606652fab5ad5f34f7747,Philipp Krop,"With recent developments in spatial computing, work contexts might shift to augmented reality. Embodied AI - virtual conversational agents backed by AI systems - have the potential to enhance these contexts and open up more communication channels than just text. To support knowledge transfer from virtual agent research to the general populace, we developed My CoWorker ChatGPT - an interactive demo where employees can try out various embodied AIs in a virtual office or their own using augmented reality. We use state-of-the-art speech synthesis and body-scanning technology to create believable and trustworthy AI assistants. The demo was shown at multiple events throughout Germany, where it was well received and sparked fruitful conversations about the possibilities of embodied AI in work contexts.",https://youtu.be/BKt5kxQQuk4,,uWHpoeN5DZ38gW6lQBMKsUQ,,Philipp,,Krop,,philipp.krop@uni-wuerzburg.de,Human-Computer Interaction Group,University of Würzburg,Würzburg,,Germany,,,,,,uSz2t_W43c92lD-jaapKohg,,David,,Obremski,,david.obremski@uni-wuerzburg.de,Psychology of Intelligent Interactive Systems,University of Würzburg,Würzburg,,Germany,,,,,,uP2zz8XS2JcQ-X4Cj54li8Q,Dr.,Astrid,,Carolus,,astrid.carolus@uni-wuerzburg.de,Media Psychology,University of Würzburg,Würzburg,,Germany,,,,,,u4oBuwJeSvYLJK98A4nE8fg,,Marc,Erich,Latoschik,,marc.latoschik@uni-wuerzburg.de,Human-Computer Interaction Group,University of Würzburg,Würzburg,,Germany,,,,,,ulFZoqTpdEz9MZ8cgvEfRyQ,Prof. Dr.,Carolin,,Wienrich,,carolin.wienrich@uni-wuerzburg.de,Psychology of Intelligent Interactive Systems,University of Würzburg,Würzburg,,Germany,,,,,,,,,,,,,,,,,,,,,,,,,,,,,,,,,,,,,,,,,,,,,,,,,,,,,,,,,,,,,,,,,,,,,,,,,,,,,,,,,,,,,,,,,,,,,,,,,,,,,,,,,,,,,,,,,,,,,,,,,,,,,Philipp Krop: University of Würzburg; David Obremski: University of Würzburg; Astrid Carolus: University of Würzburg; Marc Erich Latoschik: University of Würzburg; Carolin Wienrich: University of Würzburg,david.obremski@uni-wuerzburg.de; astrid.carolus@uni-wuerzburg.de; marc.latoschik@uni-wuerzburg.de; carolin.wienrich@uni-wuerzburg.de
PO1053,complete,"I hear, see, speak & do: Bringing Multimodal Information Processing to Intelligent Virtual Agents for Natural Human-AI Communication",Ke Li,ke.li@uni-hamburg.de,,A,4,,https://0d2f0bc53ec40041bef323f40496ed3c.r2.cloudflarestorage.com/pcs/vr25c/vr25c-sub1053-cam-i5.pdf?X-Amz-Algorithm=AWS4-HMAC-SHA256&X-Amz-Expires=7200&X-Amz-Credential=8c3c5bf11286f4699c7019eaeac51dfe%2F20250203%2Fenam%2Fs3%2Faws4_request&X-Amz-SignedHeaders=host&X-Amz-Date=20250203T201551Z&X-Amz-Signature=b3be90f90085c79f02508ac7ea49d9056a9800549d08b19f5b43d15fe76b3422,2,letter,2025-01-23 13:15,https://0d2f0bc53ec40041bef323f40496ed3c.r2.cloudflarestorage.com/pcs/vr25c/vr25c-sub1053-cam-i18.png?X-Amz-Algorithm=AWS4-HMAC-SHA256&X-Amz-Expires=7200&X-Amz-Credential=8c3c5bf11286f4699c7019eaeac51dfe%2F20250203%2Fenam%2Fs3%2Faws4_request&X-Amz-SignedHeaders=host&X-Amz-Date=20250203T201551Z&X-Amz-Signature=636af44950b1bc8d19de7d360e71d66a6d1c624b62687ccc83b595da17245e28,Ke Li,"We present an XR framework with a streamlined workflow for creating and interacting with intelligent virtual agents (IVAs) with multimodal information processing capabilities using commercially available AI tools and cloud services such as large language and vision models. The system supports: (i) the integration of high-quality, customizable virtual 3D human models for visual representations of IVAs and (ii) multimodal communication with generative AI-driven IVAs in immersive XR.",https://youtu.be/BTKCyC0GgXg,,uDxYcrlPoZ-OSZ8SY34sZcA,,Ke,,Li,,ke.li@uni-hamburg.de,Human Computer Interaction,University of Hamburg,Hamburg,,Germany,,,,,,u6aMD1xoVoVa85Yi0arz5tQ,,Fariba,,Mostajeran,,fariba.mostajeran.gourtani@uni-hamburg.de,Human-Computer Interaction,University of Hamburg,Hamburg,,Germany,,,,,,uPgaTwBVE3hfAwAmGZqIs9g,,Sebastian,,Rings,,sebastian.rings@uni-hamburg.de,,Universität Hamburg,Hamburg,,Germany,,,,,,uFwLoSUf2YGHZ7RIXOY_QtQ,,Lucie,,Kruse,,lucie.kruse@uni-hamburg.de,Human-Computer Interaction,Universität Hamburg,Hamburg,,Germany,,,,,,uhmHE0jVZlN3zRj7Se2aibw,,Susanne,,Schmidt,,susanne.schmidt@canterbury.ac.nz,HIT Lab NZ,University of Canterbury,Christchurch,,New Zealand,,,,,,uHFqk3YCOGp9b3WSy6QlIVQ,,Michael,,Arz,,michael.arz@uni-hamburg.de,Human-Computer Interaction,University of Hamburg,Hamburg,,Germany,,,,,,ueMfcyN8VLT_Gt48XDY_YEQ,,Erik,,Wolf,,erik.wolf.29@gmail.com,Human-Computer Interaction,University of Hamburg,Hamburg,,Germany,,,,,,uXDOKlYfEv06c6v_WE20g7Q,Prof. Dr.,Frank,,Steinicke,,frank.steinicke@uni-hamburg.de,Human-Computer Interaction,Universität Hamburg,Hamburg,,Germany,,,,,,,,,,,,,,,,,,,,,,,,,,,,,,,,,,,,,,,,,,,,,,,,,,,,,,,,,,,,,,,,,,,,,,,,,,Ke Li: University of Hamburg; Fariba Mostajeran: University of Hamburg; Sebastian Rings: Universität Hamburg; Lucie Kruse: Universität Hamburg; Susanne Schmidt: University of Canterbury; Michael Arz: University of Hamburg; Erik Wolf: University of Hamburg; Frank Steinicke: Universität Hamburg,fariba.mostajeran.gourtani@uni-hamburg.de; sebastian.rings@uni-hamburg.de; lucie.kruse@uni-hamburg.de; susanne.schmidt@canterbury.ac.nz; michael.arz@uni-hamburg.de; erik.wolf.29@gmail.com; frank.steinicke@uni-hamburg.de
PO1094,complete,Fashion Beneath the Skin - a Fashion Exhibition Experience in Social Virtual Reality,Karolina Wylężek,karolina@cwi.nl,,A,3.5,,https://0d2f0bc53ec40041bef323f40496ed3c.r2.cloudflarestorage.com/pcs/vr25c/vr25c-sub1094-cam-i5.pdf?X-Amz-Algorithm=AWS4-HMAC-SHA256&X-Amz-Expires=7200&X-Amz-Credential=8c3c5bf11286f4699c7019eaeac51dfe%2F20250203%2Fenam%2Fs3%2Faws4_request&X-Amz-SignedHeaders=host&X-Amz-Date=20250203T201551Z&X-Amz-Signature=981542d82882bb312b1a93b01465ca4fbe738049901754aa16b97d0be43f9efe,2,letter,2025-01-23 14:53,,Karolina Wylężek,"Social VR allows users to interact with each other and explore virtual spaces together. This demo presents a social VR fashion museum, where visitors engage with fashion artefacts. The experience spans across three different spaces designed for various goals. This application, created following a human-centred approach, explores how the visitors interact with each other and the exhibits, considering their 3D volumetric representation and changing environmental context throughout the experience.",https://www.youtube.com/watch?v=nEcP7pUq2xw,,uxHY8oeaBHWy_iUYXa0G6ig,,Karolina,,Wylężek,,karolina@cwi.nl,,CWI,Amsterdam,,Netherlands,,,,,,uKnDL-E9LKF6BudOlooaRgg,,Irene,,Viola,,irene@cwi.nl,,Centrum Wiskunde en Informatica (CWI),Amsterdam,,Netherlands,,,,,,uua0ejuZqiZgnG-VDypQ2IA,,Pablo,,Cesar,,p.s.cesar@cwi.nl,,Centrum Wiskunde & Informatica (CWI),Amsterdam,,Netherlands,,Delft University of Technology (TU Delft),Delft,,Netherlands,uVlb547vlnGy4vOFft9JZ1w,,Jack,,Jansen,,jack.jansen@cwi.nl,,Centrum Wiskunde & Informatica,Amsterdam,,Netherlands,,,,,,uYYwPXfnYTRnX14eSmBJuvw,,Suzanne,,Mulder,,smulder@centraalmuseum.nl,,Centraal Museum Utrecht,Utrecht,,Netherlands,,,,,,uw5wE0P6WVaSUyVZjRnOn6A,,Dylan,,Eno,,info@dylaneno.com,,Dylan Eno,Almere,,Netherlands,,,,,,ufKjyl0pgkZP3QuoFraODsw,,Wytze,,Koppelman,,wkoppelman@beeldengeluid.nl,,Netherlands Institute for Sound and Vision,Hilversum,,Netherlands,,,,,,uXDjmnMp3DRByDfAN8pYULA,,Marta,,Franceschini,,m.franceschini@fashionheritage.eu,,European Fashion Heritage Association,Florence,,Italy,,,,,,uE8Z_HyAilDeIztPED9Pymg,,Marco,,Rendina,,m.rendina@fashionheritage.eu,,European Fashion Heritage Association,Florence,,Netherlands,,,,,,uwCSz0H-jb8L2agVgItzLbA,,Ninke,,Bloemberg,,nbloemberg@centraalmuseum.nl,,Centraal Museum Utrecht,Utrecht,,Netherlands,,,,,,,,,,,,,,,,,,,,,,,,,,,,,,,,,,,,,,,,Karolina Wylężek: CWI; Irene Viola: Centrum Wiskunde en Informatica (CWI); Pablo Cesar: Centrum Wiskunde & Informatica (CWI); Jack Jansen: Centrum Wiskunde & Informatica; Suzanne Mulder: Centraal Museum Utrecht; Dylan Eno: Dylan Eno; Wytze Koppelman: Netherlands Institute for Sound and Vision; Marta Franceschini: European Fashion Heritage Association; Marco Rendina: European Fashion Heritage Association; Ninke Bloemberg: Centraal Museum Utrecht,irene@cwi.nl; p.s.cesar@cwi.nl; jack.jansen@cwi.nl; smulder@centraalmuseum.nl; info@dylaneno.com; wkoppelman@beeldengeluid.nl; m.franceschini@fashionheritage.eu; m.rendina@fashionheritage.eu; nbloemberg@centraalmuseum.nl
PO1069,complete,Demonstrating WAVY: a hand wearable with force and vibrotactile feedback for multimodal interaction in Virtual Reality,Marion Pontreau,marion.pontreau@cea.fr,,A,4.5,,https://0d2f0bc53ec40041bef323f40496ed3c.r2.cloudflarestorage.com/pcs/vr25c/vr25c-sub1069-cam-i5.pdf?X-Amz-Algorithm=AWS4-HMAC-SHA256&X-Amz-Expires=7200&X-Amz-Credential=8c3c5bf11286f4699c7019eaeac51dfe%2F20250203%2Fenam%2Fs3%2Faws4_request&X-Amz-SignedHeaders=host&X-Amz-Date=20250203T201551Z&X-Amz-Signature=a180835067cd5d43fc7a80de7d85ece6042eb69565a93e1fd9c8316286d58bf5,2,letter,2025-01-27 15:25,https://0d2f0bc53ec40041bef323f40496ed3c.r2.cloudflarestorage.com/pcs/vr25c/vr25c-sub1069-cam-i18.png?X-Amz-Algorithm=AWS4-HMAC-SHA256&X-Amz-Expires=7200&X-Amz-Credential=8c3c5bf11286f4699c7019eaeac51dfe%2F20250203%2Fenam%2Fs3%2Faws4_request&X-Amz-SignedHeaders=host&X-Amz-Date=20250203T201551Z&X-Amz-Signature=34e6ff48b93cbf2c9cfbd3fdc06bfeeffbd0420c19197e5b3878f694214953a9,Marion Pontreau,"While the public has access to audio and visual stimuli in virtual reality (VR) thanks to affordable and light headsets, the haptic sense (i.e. the sense of touch) is often lacking or restricted to controllers’ vibrations. Besides, commercial haptic wearables remain too expensive for the mass market. Thus, we designed an affordable and light hand wearable that combines tracking, multi-point vibrations and force feedback for the palm and the fingers. The wearable is demonstrated in a VR scenario.",https://www.youtube.com/watch?v=mhNQnxDkD5Q,,uf7UwaKxUhSbVxuiyk2562A,,Marion,,Pontreau,,marion.pontreau@cea.fr,,"Université Paris-Saclay, CEA, List",Palaiseau,,France,Sorbonne Université,Institut des Systèmes Intelligents et de Robotique,Paris,,France,uPrnqwUmunND13DfE6z7ggA,,Céphise,,Louison,,cephise.louison@cea.fr,"Universite Paris-Saclay,","CEA, List",Palaiseau,,France,,,,,,uQq5A-rPbvhmU2Jw4DwfDiw,,Pierre-Henri,,Oréfice,,pierre-henri.orefice@cea.fr,Universite Paris-Saclay,"CEA, List",Palaiseau,,France,,,,,,ug-laFI-7_rxv99IURlIcPA,PhD,Sylvain,,Bouchigny,,sylvain.bouchigny@cea.fr,"Université Paris-Saclay, CEA, List","CEA, List",Palaiseau,,France,,,,,,u8P0EWNJIltxjCxs4D-N7qg,,Thanh-loan Sarah,,LE,,le@isir.upmc.fr,"Sorbonne Université, CNRS",Institut des Systèmes Intelligents et de Robotique,Paris,,France,,,,,,ue3AFATfR-Dul4OX1S69JQg,,David,,Gueorguiev,,david.gueorguiev@uclouvain.be,Université catholique de Louvain,Institute of Neuroscience,Brussels,,Belgium,,,,,,uPnEg0OUcxOGezoGtnQbidw,,Sabrina,,Panëels,,sabrina.paneels@cea.fr,Université Paris-Saclay,"CEA, List",Palaiseau,,France,,,,,,,,,,,,,,,,,,,,,,,,,,,,,,,,,,,,,,,,,,,,,,,,,,,,,,,,,,,,,,,,,,,,,,,,,,,,,,,,,,,,,,,,,,,"Marion Pontreau: Université Paris-Saclay, CEA, List; Céphise Louison: CEA, List; Pierre-Henri Oréfice: CEA, List; Sylvain Bouchigny: CEA, List; Thanh-loan Sarah LE: Institut des Systèmes Intelligents et de Robotique; David Gueorguiev: Institute of Neuroscience; Sabrina Panëels: CEA, List",cephise.louison@cea.fr; pierre-henri.orefice@cea.fr; sylvain.bouchigny@cea.fr; le@isir.upmc.fr; david.gueorguiev@uclouvain.be; sabrina.paneels@cea.fr
PO1056,complete,LLM-powered Gaussian Splatting in VR interactions,Haotian Mao,404748294@qq.com,,A,4.5,,https://0d2f0bc53ec40041bef323f40496ed3c.r2.cloudflarestorage.com/pcs/vr25c/vr25c-sub1056-cam-i5.pdf?X-Amz-Algorithm=AWS4-HMAC-SHA256&X-Amz-Expires=7200&X-Amz-Credential=8c3c5bf11286f4699c7019eaeac51dfe%2F20250203%2Fenam%2Fs3%2Faws4_request&X-Amz-SignedHeaders=host&X-Amz-Date=20250203T201551Z&X-Amz-Signature=97fa09a1d5f587897a8a826ac7facd2ae6ca4ea3a148b16f6779c45b5e3ab6ad,2,letter,2025-01-27 12:22,https://0d2f0bc53ec40041bef323f40496ed3c.r2.cloudflarestorage.com/pcs/vr25c/vr25c-sub1056-cam-i18.png?X-Amz-Algorithm=AWS4-HMAC-SHA256&X-Amz-Expires=7200&X-Amz-Credential=8c3c5bf11286f4699c7019eaeac51dfe%2F20250203%2Fenam%2Fs3%2Faws4_request&X-Amz-SignedHeaders=host&X-Amz-Date=20250203T201551Z&X-Amz-Signature=b492dd051fad80956689169807c76edd554dc61549c70b4a777025855db0b164,Haotian Mao,"Recent advances in radiance field rendering, particularly 3D Gaussian Splatting (3DGS), have demonstrated significant potential for VR content creation, offering both high-quality rendering and an efficient production pipeline. However, current physics-based interaction systems for 3DGS are limited to either simplistic, unrealistic simulations or require substantial user input for complex scenes, largely due to the lack of scene comprehension. In this demonstration, we present a highly realistic interactive VR system powered by large language models (LLMs). After object-aware GS reconstruction, we prompt GPT-4o to analyze the physical properties of objects in the scene, which then guide physical simulations that adhere to real-world phenomena. Additionally, We design a GPT-assisted GS inpainting module to complete the areas occluded by manipulated objects. To facilitate rich interaction, we introduce a computationally efficient physical simulation framework through a PBD-based unified interpolation method, which supports various forms of physical interactions. In our research demonstrations, we reconstruct varieties of scenes enhanced by LLM's understanding, showcasing how our VR system can support complex, realistic interactions without additional manual design or annotation.",https://youtu.be/nFCFhJd6p60,,uQ5FAdPx1LIsRi_KkZoGW_A,,Haotian,,Mao,,404748294@qq.com,,Shanghai Jiao Tong University,Shanghai,,China,,,,,,ual0ivQzbt7ztJcGhWEfseQ,,Zhuoxiong,,Xu,,vector-02@sjtu.edu.cn,Shanghai Jiao Tong University,Shanghai Jiao Tong University,Shanghai,,China,,,,,,uKTwo37TKR2Z5Ex3Di2p54g,,Siyue,,Wei,,weisiyue071024@sjtu.edu.cn,Shanghai Jiao Tong University,Shanghai Jiao Tong University,Shanghai,,China,,,,,,uE-krPFmqkFFT4GWSbpqqtg,,Yule,,Quan,,qyl728@sjtu.edu.cn,Shanghai Jiao Tong University,Shanghai Jiao Tong University,Shanghai,,China,,,,,,uW1sLGrnC6XdIMlz9xS7Igw,,Nianchen,,Deng,,dengnianchen@pjlab.org.cn,,Shanghai AI Lab,Shanghai,,China,,,,,,uoEzQSEsbRUWtNwf9KadUFQ,,Xubo,,Yang,,yangxubo@sjtu.edu.cn,,SHANGHAI JIAO TONG UNIVERSITY,SHANGHAI,,China,,,,,,,,,,,,,,,,,,,,,,,,,,,,,,,,,,,,,,,,,,,,,,,,,,,,,,,,,,,,,,,,,,,,,,,,,,,,,,,,,,,,,,,,,,,,,,,,,,,,,,,,,,,,Haotian Mao: Shanghai Jiao Tong University; Zhuoxiong Xu: Shanghai Jiao Tong University; Siyue Wei: Shanghai Jiao Tong University; Yule Quan: Shanghai Jiao Tong University; Nianchen Deng: Shanghai AI Lab; Xubo Yang: SHANGHAI JIAO TONG UNIVERSITY,maohaotian@sjtu.edu.cn; vector-02@sjtu.edu.cn; weisiyue071024@sjtu.edu.cn; qyl728@sjtu.edu.cn; dengnianchen@pjlab.org.cn; yangxubo@sjtu.edu.cn
PO1100,complete,GRIPPY: A VR Grip Controller for Combating Sarcopenia in Elderly,Dr. Jiang WU,jiang.wu@nottingham.edu.cn,,A,4.5,,https://0d2f0bc53ec40041bef323f40496ed3c.r2.cloudflarestorage.com/pcs/vr25c/vr25c-sub1100-cam-i5.pdf?X-Amz-Algorithm=AWS4-HMAC-SHA256&X-Amz-Expires=7200&X-Amz-Credential=8c3c5bf11286f4699c7019eaeac51dfe%2F20250203%2Fenam%2Fs3%2Faws4_request&X-Amz-SignedHeaders=host&X-Amz-Date=20250203T201551Z&X-Amz-Signature=785899d5bd1b94f6842a2888dec334b75da2d93bbb039aeb5d23ac14b1a22a11,2,letter,2025-01-27 14:13,https://0d2f0bc53ec40041bef323f40496ed3c.r2.cloudflarestorage.com/pcs/vr25c/vr25c-sub1100-cam-i18.jpg?X-Amz-Algorithm=AWS4-HMAC-SHA256&X-Amz-Expires=7200&X-Amz-Credential=8c3c5bf11286f4699c7019eaeac51dfe%2F20250203%2Fenam%2Fs3%2Faws4_request&X-Amz-SignedHeaders=host&X-Amz-Date=20250203T201551Z&X-Amz-Signature=2f08e28677cf61debf3464eef671ddb74906e8783805023465e09f5a2210440c,Hoi Lam Leong,"As the global population ages, sarcopenia—age-related muscle decline—demands innovative solutions. This paper introduces GRIPPY, a VR grip controller that transforms basic handgrip exercises into immersive, gamified tasks. By integrating sensor-based interaction and VR gameplay, older adults can strengthen grip while maintaining higher motivation. A preliminary test with three participants (ages 68–80) revealed key usability insights, underscoring GRIPPY’s potential for enhanced rehabilitation. Future work will refine its design and validate long-term efficacy.",https://youtu.be/bgRUFUP1zbM,,uUHMprG1IMabIxiGH5BYiWw,,Hoi Lam,,Leong,,suyhl1@nottingham.edu.cn,"Department of Mechanical, Materials and Manufacturing Engineering",University of Nottingham Ningbo China,Ningbo,,China,,,,,,u1n9DqUQ_k_QDvAgBZQFh5A,Dr.,Jiang,,WU,,jiang.wu@nottingham.edu.cn,"Department of Mechanical, Materials, and Manufacturing Engineering","University of Nottingham, Ningbo, China ",Ningbo,,China,,,,,,u1KlSpY7Iz6Na4pdFoDYWzw,,Dr. Yoke Chin,,Lai,,yoke-chin.lai@nottingham.edu.cn,"Department of Mechanical, Materials and Manufacturing Engineering",University of Nottingham Ningbo China,Ningbo,,China,,,,,,uaZUL_X3i17s-g-6mrrKXmw,,Loïc,,Faulon,,loic.faulon@nottingham.edu.cn,"Department of Mechanical, Materials and Manufacturing Engineering",University of Nottingham Ningbo China,Ningbo,,China,,,,,,u1VELhWzWPqcyTVYEzNI5Vg,,Xu,,Sun,,xu.sun@nottingham.edu.cn,"Department of Mechanical, Materials and Manufacturing Engineering",University of Nottingham Ningbo China,Ningbo,,China,,,,,,u9gwp_IWUXru7uuhWpBwJAA,Dr,Boon Giin,,Lee,,boon-giin.lee@nottingham.edu.cn,School of Computer Science,University of Nottingham Ningbo China,Ningbo,Zhejiang,China,,,,,,,,,,,,,,,,,,,,,,,,,,,,,,,,,,,,,,,,,,,,,,,,,,,,,,,,,,,,,,,,,,,,,,,,,,,,,,,,,,,,,,,,,,,,,,,,,,,,,,,,,,,,"Hoi Lam Leong: University of Nottingham Ningbo China; Jiang WU: University of Nottingham, Ningbo, China ; Dr. Yoke Chin Lai: University of Nottingham Ningbo China; Loïc Faulon: University of Nottingham Ningbo China; Xu Sun: University of Nottingham Ningbo China; Boon Giin Lee: University of Nottingham Ningbo China",suyhl1@nottingham.edu.cn; yoke-chin.lai@nottingham.edu.cn; loic.faulon@nottingham.edu.cn; xu.sun@nottingham.edu.cn; boon-giin.lee@nottingham.edu.cn
