name,affiliation
"Ablett, Daniel","University of South Australia, Australia"
"Abraham, Melvin","School of Computer Science, University of Glasgow, United Kingdom"
"Abu Bakar, Muhammad","Computer Science and Engineering, Yuan Ze University, Taiwan"
"Adeniyi, Sam","University of Minnesota, United States"
"Adhanom, Isayas","Computer Science and Engineering, University of Minnesota, United States"
"Ahmed, Naveed","Department of Computer Science, University of Sharjah, United Arab Emirates"
"Ahn, Grace",
"Alavesa, Paula","Center for Ubiquitous Computing, University of Oulu, Finland"
"Albuquerque, Georgia","Software Technology / Software for Space Systems and Interactive Visualization , German Aerospace Center, Germany"
"Alhilal, Ahmad","Computer Science Dept, Aalto University, Finland"
"Allison, Robert","Department of Electrical Engineering and Computer Science, York University, Canada"
"AlRawi, Layth","Interactive Design Research Group, Klagenfurt University, Austria"
"Amure, Ridwan","Collaboratorium for Online Social Media and Behavioral Studies, University of Arkansas at Little Rock, United States"
"Anderton, Craig","College of Computing, Birmingham City University, United Kingdom"
"Anthes, Christoph","University of Applied Sciences Upper Austria, Austria"
"Anvari, Taravat","Institute for Psychology, University of Muenster, Germany"
"Aranha, Renan","University of São Paulo, Brazil"
"Arevalo Arboleda, Stephanie","Audiovisual Technology Group, Technische Universität Ilmenau, Germany"
"Argo, Erin","Augusta University, United States"
"Asish, Sarker Monojit","Computer Science, Florida Polytechnic University, United States"
"Assor, Ambre","Université Paris-Saclay , Inria, CNRS, LISN, France"
"Bachinski, Miroslav","Department of Information Science and Media Studies, University of Bergen, Norway"
"Bae, S. Sandra","ATLAS Institute, University of Colorado Boulder, United States"
"Bai, Xiaoyang","Department of Electrical and Electronic Engineering, The University of Hong Kong, Hong Kong"
"Ban, Yuki","The University of Tokyo, Japan"
"Banakou, Domna","University of Barcelona, Spain"
"Barmaki, Roghayeh","Computer and Information Sciences, University of Delaware, United States"
"Barrera Machuca, Mayra","Faculty of Computer Science, Dalhousie University, Canada"
"Bashar, Mohammad Raihanul","Department of Computer Science & Software Engineering, Concordia University, Canada"
"Basu, Aryabrata","Department of Computer Science, University of Arkansas at Little Rock, United States"
"Baudry, David","LINEACT, CESI, France"
"Behravan, Majid","Virginia Tech, United States"
"Belani, Manshul","Mélange Lab, IIIT-Delhi, India"
"Bell, Blaine","Blaine Bell, United States"
"Benjamin, Juanita","University of Central Florida, United States"
"Benmahdjoub, Mohamed","Biomedical Imaging Group Rotterdam, Erasmus MC, Netherlands"
"Bergamasco, Leila","Computer Science, University Center FEI, Brazil"
"Berthaut, Florent","CRIStAL, Université de Lille, France"
"Bessa, Maximino","INESC TEC, Portugal"
"Bezanson, Katherine","Texas A&M University, United States"
"Bhardwaj, Ayush","Department of Computer Science, The University of Texas at Dallas, United States"
"Bhattacharya, Aneesh","Computer Science and Engineering, IIIT Naya Raipur, India"
"Bhattacharya, Uttaran","Adobe Inc., United States"
"Bi, Haocheng","Boston Consulting Group, United States"
"Biehl, Jacob","School of Computing and Information, University of Pittsburgh, United States"
"Biener, Verena","University of Stuttgart, Germany"
"Boem, Alberto","Department of Information Engineering and Computer Science, University of Trento, Italy"
"Bohak, Ciril","Faculty of Computer and Information Science, University of Ljubljana, Slovenia"
"Boorboor, Saeed","Computer Science, Stony Brook University, United States"
"Borhani, Zahra","Computer Science Department, Colorado State University, United States"
"Borst, Christoph","Center for Advanced Computer Studies, University of Louisiana at Lafayette, United States"
"Bosco, Matteo","TU Wien, Austria"
"Botev, Jean","VR/AR Lab, University of Luxembourg, Luxembourg"
"Boucaud, Fabien","Sorbonne Université, ISIR, France"
"Bougrain, Laurent","LORIA, Université de Lorraine, France"
"Bourdin-Kreitz, Pierre","Computer Science, Multimedia and Telecommunications Department (EIMT), Universitat Oberta de Catalunya, Spain"
"Bozkir, Efe","Human-Centered Technologies for Learning, Technical University of Munich, Germany"
"Brown, Phillip","Cognitive Science and Artificial Intelligence, Tilburg University, Netherlands"
"Brübach, Larissa","Human-Computer Interaction Group, University of Würzburg, Germany"
"Bruder, Gerd","SREAL, University of Central Florida, United States"
"Brudy, Frederik","Autodesk Research, Canada"
"Bullock, Tom","Psychology & Brain Sciences, University of California -- Santa Barbara, United States"
"Bustillo, Andrés","Universidad de Burgos, Spain"
"Buttussi, Fabio","HCI Lab - Department of Mathematics, Computer Science, and Physics, University of Udine, Italy"
"Cabrera-Araya, Raquel","College of Performance, Visualization and Fine Arts, Texas A&M University , United States"
"Cai, Shaoyu","College of Design and Engineering, National University of Singapore, Singapore"
"Calisto, Francisco Maria","ITI/LARSyS, IST - U. Lisboa, Portugal"
"Caluya, Nicko","Visual Information Engineering Laboratory, Ritsumeikan University, Japan"
"Camacho Fidalgo, Graciela","Texas A&M, United States"
"Canales, Ryan","Clemson University, United States"
"Cantory, Ville","University of Minnesota, United States"
"Capobianco, Antonio","ICube, Université de Strasbourg, France"
"Cauchard, Jessica","TU Wien, Austria"
"Chaffangeon Caillet, Adrien","Univ. Grenoble Alpes, CNRS, Grenoble INP, LIG, France"
"Chakraborty, Akashdeep","Interactive Systems and User Experience Lab, University of Central Florida, United States"
"Chandio, Yasra","Department of Electrical and Computer Engineering , University of Massachusetts, Amherst, United States"
"Chang, Wenjie","University of Science and Technology of China, China"
"Chang, Zhuang","Auckland Bioengineering Institute, The University of Auckland, New Zealand"
"Chardonnet, Jean-Rémy","LISPEN EA7515, Arts et Metiers Institute of Technology, France"
"Chattopadhyay, Debaleena","Computer Science, University of Illinois at Chicago, United States"
"Cheiran, Jean Felipe","Campus Alegrete, Federal University of Pampa, Brazil"
"Chen, Kenneth","New York University, United States"
"Chen, Liuqing","College of Computer Science and Technology, Zhejiang University, China"
"Chen, Yuan","Cheriton School of Computer Science, University of Waterloo, Canada"
"Cheng, Haojie","Immersive Reality Lab, National University of Singapore, Singapore"
"Cheng, Lung-Pan","National Taiwan University, Taiwan"
"Cherng, Fu-Yin","Department of Computer Science and Information Engineering, National Chung Cheng University, Taiwan"
"Cheymol, Antonin","Department of Mechano-Informatics, Graduate School of Information Science and Technology, Kuzuoka-Amemiya-Narumi Lab, The University of Tokyo, Japan"
"Chiba, Naoya","D3 Center, Osaka Unversity, Japan"
"Chihak, Ben","coe college, United States"
"Chinello, Francesco","Aarhus University, Denmark"
"Chittaro, Luca","HCI Lab, University of Udine, Italy"
"Cho, Hyunsung","Human-Computer Interaction Institute, Carnegie Mellon University, United States"
"Choi, Myungguen","Human-Computer Interaction Lab, Hokkaido University, Japan"
"Choi, Suyeon",
"Chollet, Mathieu","School of Computing Science, University of Glasgow, United Kingdom"
"choudhury, nusrat","National Research Council Canada, Canada"
"Chuang, Chun-Hsiang",
"Chuang, Jung-Hong","Dept of Computer Science, National Yang Ming Chiao Tung University, Taiwan"
"Cibulskis, Mantas","University of Copenhagen, Denmark"
"Clarke, Thomas","IVE/Wearable Computer Lab, University of South Australia, Australia"
"Coelho, Luis Filipe Martins Pinto","Instituto superior de engenharia do Porto , Portugal"
"Colley, Mark","UCL Interaction Centre, United Kingdom"
"Cools, Robbe","Department of Computer Science, KU Leuven, Belgium"
"Corrêa, Cleber","Universidade Tecnológica Federal do Paraná, Brazil"
"Correa de Almeida, Gustavo","VIZLAB - Geoinformatics and Visualization Lab, UNISINOS , Brazil"
"Costa Sousa, Mario","University of Calgary, Canada"
"Creem-Regehr, Sarah","Psychology, University of Utah, United States"
"Culbertson, Heather","Computer Science, University of Southern California, United States"
"Danieau, Fabien","Pollen Robotics, France"
"Darbar, Rajkumar","Laboratoire de Biochimie Théorique, Institut de Biologie Physico-Chimique, France"
"David-John, Brendan","Department of Computer Science, Virginia Tech, United States"
"de Jesus Oliveira, Victor Adriel","Institute of Creative\Media/Technologies, St. Poelten University of Applied Sciences, Austria"
"De Pace, Francesco","Institute of Visual Computing and Human-Centered Technology, TU Wien, Austria"
"Delamare, William","Univ. Bordeaux, ESTIA-Institute of Technology, EstiaR, France"
"Dever, Daryn","University of Central Florida, United States"
"Dias, Alexandre",
"Didier, Jean-Yves","IBISC, Univ Evry, Université Paris-Saclay, France"
"Dileepraj kidiyur, Mridula","IEEE, United States"
"Ding, Zhicheng","Columbia Univeristy, United States"
"Do, Tiffany","Computer Science, Drexel University, United States"
"Dominjon, Lionel","CLARTE, France"
"Dongye, Xiaonuo","Beijing Institute of Technology, China"
"Dorneich, Michael","Industrial and Manufacturing Systems Engineering, Iowa State University, United States"
"Drogemuller, Adam",
"Du, Ruofei","Google, United States"
"Du, Xiaojiao","IVE, University of South Australia, Australia"
"Duan, Huiyu","Shanghai Jiao Tong University, China"
"Duchowski, Andrew","School of Computing, Clemson University, United States"
"Dudley, John","Department of Engineering, University of Cambridge, United Kingdom"
"Dufresne-Camaro, Charles-Olivier","Computer Science, University of British Columbia, Canada"
"Duinkharjav, Budmonde","Tandon School of Engineering, New York University, United States"
"Dwyer, Tim","Data Visualisation and Immersive Analytics, Monash University, Australia"
"Ebrahimi, Elham","Computer Science Department, UNC Wilmington, United States"
"Eck, Ulrich","Chair for Computer Aided Medical Procedures, Technische Universitaet Muenchen, Germany"
"Eckhoff, Daniel","eXtended Reality Lab / School of Creative Media, City University of Hong Kong, Hong Kong"
"Efraimidis, Michael","Technical University of Crete, TUC, Greece"
"Ehtesham-Ul-Haque, Md","College of Information Sciences and Technology, Pennsylvania State University, United States"
"Eisemann, Elmar","Computer Graphics and Visualization, Delft University of Technology, Netherlands"
"ElSayed, Neven","Human AI Interaction, Know-Center GmbH, Austria"
"Engel, Don","University of Maryland, Baltimore County, United States"
"Ennis, Cathy","Computer Science, TU Dublin, Ireland"
"Erel, Yotam","Tel Aviv University, Israel"
"Esteves, Augusto","ITI / LARSyS, Instituto Superior Técnico, University of Lisbon, Portugal"
"Evangelista, Alessandro","DMMM, Polytechnic University of Bari, Italy"
"F Paulo, Soraia","ITI/LARSyS, Instituto Superior Técnico, University of Lisbon, Portugal"
"Fan, Mingming","The Hong Kong University of Science and Technology (Guangzhou), China"
"Fan, Runze","State Key Laboratory of Virtual Reality Technology and Systems, Beihang University, China"
"Farzinnejad, Forouzan","Coburg University of applied sciences and arts, Germany"
"Fascetti, Alessandro","University of Pittsburgh, United States"
"Feick, Martin","DFKI and Saarland University, Saarland Informatics Campus, Germany"
"Feijóo-García, Pedro Guillermo","College of Computing/School of Computing Instruction, Georgia Institute of Technology, United States"
"Feld, Nico","Trier University, Germany"
"Folmer, Eelke","Computer Science and Engineering, University of Nevada, United States"
"Fontana, Federico","University of Udine, Italy"
"Foulonneau, Anthony","Orange, France"
"Fox, Dylan","XR Access, Cornell Tech, United States"
"Friederichs, Kylee","Texas A&M University, United States"
"Frisson, Christian","Metalab, Society for Art and Technology, Canada"
"Froehlich, Bernd","Virtual Reality and Visualization Research Group, Bauhaus-Universität Weimar, Germany"
"Frumento, Sergio","University of Pisa, Italy"
"Fujisawa, Makoto","Faculty of Library, Information and Media Science, University of Tsukuba, Japan"
"Fujita, Kazuyuki","Research Institute of Electrical Communication, Tohoku University, Japan"
"Fukiage, Taiki",
"Furuya, Hiroshi","Synthetic Reality Lab, University of Central Florida, United States"
"Gabbard, Joseph","Virginia Tech, United States"
"Gabel, Jenny","Human Computer Interaction, Universität Hamburg, Germany"
"Gagnon, Holly","Psychology, University of Utah, United States"
"Gain, James","Computer Science Department, University of Cape Town, South Africa"
"Gan, Qi Wen","Department of Computer Science, Tsinghua University, China"
"Gandhi, Arfive","School of Computing, Telkom University, Indonesia"
"Ganias, Giorgos","Department of Informatics and Telecommunications, National and Kapodistrian University of Athens, Greece"
"Gao, Zenggui","Shanghai University, China"
"García Bauza, Cristian","Media.Lab, Instituto PLADEMA, UNCPBA, Argentina"
"Gattullo, Michele","DMMM, Polytechnic University of Bari, Italy"
"Gellersen, Hans","Aarhus University, Denmark"
"Genay, Adélaïde","School of Computing and Information Systems, University of Melbourne, Australia"
"Geronazzo, Michele","Department of Engineering and Management , University of Padua, Italy"
"Ghazanfari, Mohammad","Virtual and Augmented Reality Group, TU Wien, Austria"
"Ghosh, Rashi","Virtual Experiences Research Group, Department of Computer and Information Science and Engineering, University of Florida, United States"
"Gilbert, David","Visual Computing Institute, RWTH Aachen, Germany"
"Gilbert, Stephen","Virtual Reality Applications Center, Iowa State University, United States"
"Giraud, Frédéric","Research in Orthopedic Computer Science, Balgrist University Hospital, Switzerland"
"Goli, Amir","School of Architecture and Design, University of Kansas, United States"
"Gonzalez-Franco, Mar","Google, United States"
"Goodwin, Sarah","Monash University, Australia"
"Gottsacker, Matt","SREAL, University of Central Florida, United States"
"Grandi, Jeronimo","Computer & Cyber Sciences, Augusta University, United States"
"Greene, Nicholas","Computer Science, Johns Hopkins University, United States"
"Groth, Colin","TU Braunschweig, Germany"
"Gruchalla, Kenny","Computational Science Center, National Renewable Energy Lab, United States"
"Guerreiro, João","LASIGE, Faculdade de Ciências, Universidade de Lisboa, Portugal"
"Guo, Hung-Jui","The University of Texas at Dallas, Software Engineering department, United States"
"Guo, Yudong","USTC, China"
"Guo, Zixuan","School of Advanced Technology, Xi'an Jiaotong-Liverpool University, China"
"Gupta, Kunal","Empathic Computing Laboratory, The University of Auckland, New Zealand"
"Gupta, Prerit","Computer Science, Purdue University, United States"
"Gyreyiri, Paul","Electrical Engineering and Computer Science Department, University of Wyoming, United States"